EDL	Record In	Record Out	Clipname	Subtitle
EDL	00:00:00,256	00:00:01,792	| 20181127_hibt_lyft2.mp3_76fb3869d4400dd7c8887ca9e601f5e6_18196451 |	Support for this podcast
EDL	00:00:01,792	00:00:03,584	| 20181127_hibt_lyft2.mp3_76fb3869d4400dd7c8887ca9e601f5e6_18196451 |	In the following message come from Madewell
EDL	00:00:03,584	00:00:05,888	| 20181127_hibt_lyft2.mp3_76fb3869d4400dd7c8887ca9e601f5e6_18196451 |	Where the motto is good day start
EDL	00:00:05,888	00:00:06,400	| 20181127_hibt_lyft2.mp3_76fb3869d4400dd7c8887ca9e601f5e6_18196451 |	With great jeans
EDL	00:00:06,912	00:00:07,936	| 20181127_hibt_lyft2.mp3_76fb3869d4400dd7c8887ca9e601f5e6_18196451 |	Madewell offer
EDL	00:00:07,936	00:00:10,496	| 20181127_hibt_lyft2.mp3_76fb3869d4400dd7c8887ca9e601f5e6_18196451 |	Premium denim styles for seriously everyone
EDL	00:00:11,008	00:00:12,544	| 20181127_hibt_lyft2.mp3_76fb3869d4400dd7c8887ca9e601f5e6_18196451 |	Stop by a Madewell store
EDL	00:00:12,544	00:00:14,336	| 20181127_hibt_lyft2.mp3_76fb3869d4400dd7c8887ca9e601f5e6_18196451 |	Or go to madewell.com
EDL	00:00:14,336	00:00:15,360	| 20181127_hibt_lyft2.mp3_76fb3869d4400dd7c8887ca9e601f5e6_18196451 |	Define your
EDL	00:00:15,360	00:00:15,872	| 20181127_hibt_lyft2.mp3_76fb3869d4400dd7c8887ca9e601f5e6_18196451 |	Perfect pear
EDL	00:00:16,896	00:00:19,200	| 20181127_hibt_lyft2.mp3_76fb3869d4400dd7c8887ca9e601f5e6_18196451 |	Support for the how I built this Summit comes from
EDL	00:00:19,200	00:00:20,224	| 20181127_hibt_lyft2.mp3_76fb3869d4400dd7c8887ca9e601f5e6_18196451 |	American Express
EDL	00:00:20,224	00:00:23,552	| 20181127_hibt_lyft2.mp3_76fb3869d4400dd7c8887ca9e601f5e6_18196451 |	Offering eligible cardmembers flexible Funding Solutions
EDL	00:00:24,320	00:00:26,624	| 20181127_hibt_lyft2.mp3_76fb3869d4400dd7c8887ca9e601f5e6_18196451 |	Smart Savvy way to fund your business
EDL	00:00:27,392	00:00:28,928	| 20181127_hibt_lyft2.mp3_76fb3869d4400dd7c8887ca9e601f5e6_18196451 |	Powerful backing of American
EDL	00:00:28,928	00:00:31,232	| 20181127_hibt_lyft2.mp3_76fb3869d4400dd7c8887ca9e601f5e6_18196451 |	Express don't do business without it
EDL	00:00:31,232	00:00:32,000	| 20181127_hibt_lyft2.mp3_76fb3869d4400dd7c8887ca9e601f5e6_18196451 |	Terms apply
EDL	00:00:32,768	00:00:34,560	| 20181127_hibt_lyft2.mp3_76fb3869d4400dd7c8887ca9e601f5e6_18196451 |	Americanexpress.com
EDL	00:00:34,560	00:00:35,072	| 20181127_hibt_lyft2.mp3_76fb3869d4400dd7c8887ca9e601f5e6_18196451 |	Business
EDL	00:00:40,960	00:00:42,752	| 20181127_hibt_lyft2.mp3_76fb3869d4400dd7c8887ca9e601f5e6_18196451 |	Hey everyone this guy here
EDL	00:00:42,752	00:00:46,592	| 20181127_hibt_lyft2.mp3_76fb3869d4400dd7c8887ca9e601f5e6_18196451 |	Another bonus episode from the how I built this
EDL	00:00:46,592	00:00:50,176	| 20181127_hibt_lyft2.mp3_76fb3869d4400dd7c8887ca9e601f5e6_18196451 |	Summit in San Francisco that happened back in October
EDL	00:00:50,176	00:00:53,504	| 20181127_hibt_lyft2.mp3_76fb3869d4400dd7c8887ca9e601f5e6_18196451 |	It's for my live interview with John Zimmer that co-founder of Lyft
EDL	00:00:53,504	00:00:57,600	| 20181127_hibt_lyft2.mp3_76fb3869d4400dd7c8887ca9e601f5e6_18196451 |	And my original conversation with John ran back in February
EDL	00:00:57,600	00:00:58,112	| 20181127_hibt_lyft2.mp3_76fb3869d4400dd7c8887ca9e601f5e6_18196451 |	Of last year
EDL	00:00:58,624	00:01:01,184	| 20181127_hibt_lyft2.mp3_76fb3869d4400dd7c8887ca9e601f5e6_18196451 |	I heard that you may want to check it out
EDL	00:01:01,184	00:01:02,208	| 20181127_hibt_lyft2.mp3_76fb3869d4400dd7c8887ca9e601f5e6_18196451 |	Because in it
EDL	00:01:02,208	00:01:06,048	| 20181127_hibt_lyft2.mp3_76fb3869d4400dd7c8887ca9e601f5e6_18196451 |	John tells the story of how he launched his first ride-sharing
EDL	00:01:06,048	00:01:06,816	| 20181127_hibt_lyft2.mp3_76fb3869d4400dd7c8887ca9e601f5e6_18196451 |	Service in college
EDL	00:01:07,328	00:01:12,448	| 20181127_hibt_lyft2.mp3_76fb3869d4400dd7c8887ca9e601f5e6_18196451 |	And happiness co-founder Logan green went on to build one of the biggest ride-hailing apps
EDL	00:01:12,448	00:01:13,472	| 20181127_hibt_lyft2.mp3_76fb3869d4400dd7c8887ca9e601f5e6_18196451 |	In the world
EDL	00:01:13,472	00:01:16,544	| 20181127_hibt_lyft2.mp3_76fb3869d4400dd7c8887ca9e601f5e6_18196451 |	They say one of the biggest court because 12
EDL	00:01:16,544	00:01:17,824	| 20181127_hibt_lyft2.mp3_76fb3869d4400dd7c8887ca9e601f5e6_18196451 |	There's scoober
EDL	00:01:17,824	00:01:20,640	| 20181127_hibt_lyft2.mp3_76fb3869d4400dd7c8887ca9e601f5e6_18196451 |	It's no secret that those two companies
EDL	00:01:20,640	00:01:24,736	| 20181127_hibt_lyft2.mp3_76fb3869d4400dd7c8887ca9e601f5e6_18196451 |	They have been in a fierce competition pretty much since they launched
EDL	00:01:24,736	00:01:27,040	| 20181127_hibt_lyft2.mp3_76fb3869d4400dd7c8887ca9e601f5e6_18196451 |	It's a rivalry that's up there with
EDL	00:01:27,040	00:01:27,808	| 20181127_hibt_lyft2.mp3_76fb3869d4400dd7c8887ca9e601f5e6_18196451 |	You know
EDL	00:01:27,808	00:01:29,856	| 20181127_hibt_lyft2.mp3_76fb3869d4400dd7c8887ca9e601f5e6_18196451 |	Coke and Pepsi are McDonald's and Burger King
EDL	00:01:30,368	00:01:31,904	| 20181127_hibt_lyft2.mp3_76fb3869d4400dd7c8887ca9e601f5e6_18196451 |	And that competition
EDL	00:01:31,904	00:01:33,440	| 20181127_hibt_lyft2.mp3_76fb3869d4400dd7c8887ca9e601f5e6_18196451 |	And how it's affected lift
EDL	00:01:33,952	00:01:36,512	| 20181127_hibt_lyft2.mp3_76fb3869d4400dd7c8887ca9e601f5e6_18196451 |	Is one of the things I wanted to ask John about
EDL	00:01:36,512	00:01:37,792	| 20181127_hibt_lyft2.mp3_76fb3869d4400dd7c8887ca9e601f5e6_18196451 |	We sat down to talk
EDL	00:01:37,792	00:01:39,584	| 20181127_hibt_lyft2.mp3_76fb3869d4400dd7c8887ca9e601f5e6_18196451 |	At yerba buena Center for the Arts
EDL	00:01:39,584	00:01:40,352	| 20181127_hibt_lyft2.mp3_76fb3869d4400dd7c8887ca9e601f5e6_18196451 |	In San Francisco
EDL	00:01:47,264	00:01:47,776	| 20181127_hibt_lyft2.mp3_76fb3869d4400dd7c8887ca9e601f5e6_18196451 |	Are you doing
EDL	00:01:48,288	00:01:49,312	| 20181127_hibt_lyft2.mp3_76fb3869d4400dd7c8887ca9e601f5e6_18196451 |	Yeah
EDL	00:01:49,312	00:01:50,848	| 20181127_hibt_lyft2.mp3_76fb3869d4400dd7c8887ca9e601f5e6_18196451 |	Did you guys hear his episode
EDL	00:01:50,848	00:01:52,128	| 20181127_hibt_lyft2.mp3_76fb3869d4400dd7c8887ca9e601f5e6_18196451 |	One of our earlier episodes
EDL	00:01:52,128	00:01:54,176	| 20181127_hibt_lyft2.mp3_76fb3869d4400dd7c8887ca9e601f5e6_18196451 |	Really amazing story
EDL	00:01:55,200	00:01:56,736	| 20181127_hibt_lyft2.mp3_76fb3869d4400dd7c8887ca9e601f5e6_18196451 |	Curiosity
EDL	00:01:56,736	00:02:01,088	| 20181127_hibt_lyft2.mp3_76fb3869d4400dd7c8887ca9e601f5e6_18196451 |	Anthony a given day you might not be able to say the exact numbers but roughly
EDL	00:02:01,088	00:02:03,136	| 20181127_hibt_lyft2.mp3_76fb3869d4400dd7c8887ca9e601f5e6_18196451 |	On a given day how many people use Lyft
EDL	00:02:03,648	00:02:04,416	| 20181127_hibt_lyft2.mp3_76fb3869d4400dd7c8887ca9e601f5e6_18196451 |	So
EDL	00:02:04,416	00:02:06,208	| 20181127_hibt_lyft2.mp3_76fb3869d4400dd7c8887ca9e601f5e6_18196451 |	Every month we do over 50 million
EDL	00:02:07,232	00:02:08,000	| 20181127_hibt_lyft2.mp3_76fb3869d4400dd7c8887ca9e601f5e6_18196451 |	Wow
EDL	00:02:08,000	00:02:08,512	| 20181127_hibt_lyft2.mp3_76fb3869d4400dd7c8887ca9e601f5e6_18196451 |	It's amazing
EDL	00:02:09,024	00:02:09,536	| 20181127_hibt_lyft2.mp3_76fb3869d4400dd7c8887ca9e601f5e6_18196451 |	Missing
EDL	00:02:10,304	00:02:14,144	| 20181127_hibt_lyft2.mp3_76fb3869d4400dd7c8887ca9e601f5e6_18196451 |	But what was his idea because when you started
EDL	00:02:14,144	00:02:18,240	| 20181127_hibt_lyft2.mp3_76fb3869d4400dd7c8887ca9e601f5e6_18196451 |	This idea when you came up with the idea for lifted did you guys think of this as a simple idea
EDL	00:02:19,008	00:02:22,592	| 20181127_hibt_lyft2.mp3_76fb3869d4400dd7c8887ca9e601f5e6_18196451 |	Innocence when this started we had a tagline that was your friend with a car
EDL	00:02:23,360	00:02:24,384	| 20181127_hibt_lyft2.mp3_76fb3869d4400dd7c8887ca9e601f5e6_18196451 |	It was that it was that simple
EDL	00:02:25,152	00:02:26,176	| 20181127_hibt_lyft2.mp3_76fb3869d4400dd7c8887ca9e601f5e6_18196451 |	There are
EDL	00:02:26,944	00:02:29,504	| 20181127_hibt_lyft2.mp3_76fb3869d4400dd7c8887ca9e601f5e6_18196451 |	250 million vehicles in the United States
EDL	00:02:29,504	00:02:31,040	| 20181127_hibt_lyft2.mp3_76fb3869d4400dd7c8887ca9e601f5e6_18196451 |	Aleve and they're used
EDL	00:02:31,552	00:02:33,344	| 20181127_hibt_lyft2.mp3_76fb3869d4400dd7c8887ca9e601f5e6_18196451 |	Each car is used for percent of the time
EDL	00:02:33,856	00:02:35,392	| 20181127_hibt_lyft2.mp3_76fb3869d4400dd7c8887ca9e601f5e6_18196451 |	96% of the time at the park
EDL	00:02:35,904	00:02:37,440	| 20181127_hibt_lyft2.mp3_76fb3869d4400dd7c8887ca9e601f5e6_18196451 |	So the simple idea was
EDL	00:02:37,952	00:02:40,768	| 20181127_hibt_lyft2.mp3_76fb3869d4400dd7c8887ca9e601f5e6_18196451 |	You know you know that time where you had a friend with a car
EDL	00:02:40,768	00:02:44,352	| 20181127_hibt_lyft2.mp3_76fb3869d4400dd7c8887ca9e601f5e6_18196451 |	I got you where you needed to go what if we could utilize these cars more
EDL	00:02:45,120	00:02:47,168	| 20181127_hibt_lyft2.mp3_76fb3869d4400dd7c8887ca9e601f5e6_18196451 |	We could offer new job opportunities
EDL	00:02:47,168	00:02:48,192	| 20181127_hibt_lyft2.mp3_76fb3869d4400dd7c8887ca9e601f5e6_18196451 |	For those that needed it
EDL	00:02:48,192	00:02:49,216	| 20181127_hibt_lyft2.mp3_76fb3869d4400dd7c8887ca9e601f5e6_18196451 |	Inflexibility
EDL	00:02:49,216	00:02:50,240	| 20181127_hibt_lyft2.mp3_76fb3869d4400dd7c8887ca9e601f5e6_18196451 |	Think about a single parent
EDL	00:02:50,752	00:02:52,800	| 20181127_hibt_lyft2.mp3_76fb3869d4400dd7c8887ca9e601f5e6_18196451 |	Who can't work a 9 to 5
EDL	00:02:52,800	00:02:54,080	| 20181127_hibt_lyft2.mp3_76fb3869d4400dd7c8887ca9e601f5e6_18196451 |	Having
EDL	00:02:54,080	00:02:55,360	| 20181127_hibt_lyft2.mp3_76fb3869d4400dd7c8887ca9e601f5e6_18196451 |	The timing flexibility
EDL	00:02:55,360	00:02:58,432	| 20181127_hibt_lyft2.mp3_76fb3869d4400dd7c8887ca9e601f5e6_18196451 |	It was large and so that was the simple idea let's create your friend with a car
EDL	00:02:58,432	00:03:00,224	| 20181127_hibt_lyft2.mp3_76fb3869d4400dd7c8887ca9e601f5e6_18196451 |	At a community level
EDL	00:03:00,224	00:03:01,504	| 20181127_hibt_lyft2.mp3_76fb3869d4400dd7c8887ca9e601f5e6_18196451 |	And that's how it began
EDL	00:03:01,504	00:03:04,832	| 20181127_hibt_lyft2.mp3_76fb3869d4400dd7c8887ca9e601f5e6_18196451 |	What is it and how much of it was driven by the sense of
EDL	00:03:05,344	00:03:06,624	| 20181127_hibt_lyft2.mp3_76fb3869d4400dd7c8887ca9e601f5e6_18196451 |	We want to kind of
EDL	00:03:06,624	00:03:07,648	| 20181127_hibt_lyft2.mp3_76fb3869d4400dd7c8887ca9e601f5e6_18196451 |	Recreate
EDL	00:03:07,648	00:03:08,672	| 20181127_hibt_lyft2.mp3_76fb3869d4400dd7c8887ca9e601f5e6_18196451 |	Our relationship
EDL	00:03:08,672	00:03:10,208	| 20181127_hibt_lyft2.mp3_76fb3869d4400dd7c8887ca9e601f5e6_18196451 |	With automobiles assertive
EDL	00:03:10,208	00:03:11,232	| 20181127_hibt_lyft2.mp3_76fb3869d4400dd7c8887ca9e601f5e6_18196451 |	Idealistic
EDL	00:03:11,232	00:03:13,280	| 20181127_hibt_lyft2.mp3_76fb3869d4400dd7c8887ca9e601f5e6_18196451 |	An ocean and and how much it was
EDL	00:03:13,280	00:03:15,328	| 20181127_hibt_lyft2.mp3_76fb3869d4400dd7c8887ca9e601f5e6_18196451 |	We want to completely disrupt an industry
EDL	00:03:16,608	00:03:18,912	| 20181127_hibt_lyft2.mp3_76fb3869d4400dd7c8887ca9e601f5e6_18196451 |	I never thought about disrupting an industry
EDL	00:03:19,424	00:03:20,960	| 20181127_hibt_lyft2.mp3_76fb3869d4400dd7c8887ca9e601f5e6_18196451 |	We knew that was possible
EDL	00:03:21,472	00:03:23,776	| 20181127_hibt_lyft2.mp3_76fb3869d4400dd7c8887ca9e601f5e6_18196451 |	We were aware of
EDL	00:03:23,776	00:03:29,920	| 20181127_hibt_lyft2.mp3_76fb3869d4400dd7c8887ca9e601f5e6_18196451 |	Early days in San Francisco when we started I sat down with the general managers of the three major taxi companies
EDL	00:03:30,432	00:03:32,480	| 20181127_hibt_lyft2.mp3_76fb3869d4400dd7c8887ca9e601f5e6_18196451 |	Because I wanted to understand their perspective
EDL	00:03:32,480	00:03:35,040	| 20181127_hibt_lyft2.mp3_76fb3869d4400dd7c8887ca9e601f5e6_18196451 |	And I wanted to make sure that the work we're doing
EDL	00:03:35,040	00:03:35,552	| 20181127_hibt_lyft2.mp3_76fb3869d4400dd7c8887ca9e601f5e6_18196451 |	Had enough
EDL	00:03:36,064	00:03:38,112	| 20181127_hibt_lyft2.mp3_76fb3869d4400dd7c8887ca9e601f5e6_18196451 |	The positive benefit on society so
EDL	00:03:38,624	00:03:40,672	| 20181127_hibt_lyft2.mp3_76fb3869d4400dd7c8887ca9e601f5e6_18196451 |	I'm heading disruption with something.
EDL	00:03:41,184	00:03:42,720	| 20181127_hibt_lyft2.mp3_76fb3869d4400dd7c8887ca9e601f5e6_18196451 |	I became part of
EDL	00:03:42,720	00:03:44,000	| 20181127_hibt_lyft2.mp3_76fb3869d4400dd7c8887ca9e601f5e6_18196451 |	The equation but wasn't the
EDL	00:03:44,512	00:03:47,072	| 20181127_hibt_lyft2.mp3_76fb3869d4400dd7c8887ca9e601f5e6_18196451 |	Reason why we began alright let's talk about the competition
EDL	00:03:47,840	00:03:49,376	| 20181127_hibt_lyft2.mp3_76fb3869d4400dd7c8887ca9e601f5e6_18196451 |	Pretty soon after your
EDL	00:03:49,376	00:03:50,144	| 20181127_hibt_lyft2.mp3_76fb3869d4400dd7c8887ca9e601f5e6_18196451 |	After your lunch
EDL	00:03:50,656	00:03:53,216	| 20181127_hibt_lyft2.mp3_76fb3869d4400dd7c8887ca9e601f5e6_18196451 |	Uber kind of step into your territory with
EDL	00:03:53,728	00:03:56,800	| 20181127_hibt_lyft2.mp3_76fb3869d4400dd7c8887ca9e601f5e6_18196451 |	With Uber with a premium Black Car service
EDL	00:03:57,312	00:03:59,872	| 20181127_hibt_lyft2.mp3_76fb3869d4400dd7c8887ca9e601f5e6_18196451 |	And once lift got traction Uber
EDL	00:04:00,384	00:04:02,432	| 20181127_hibt_lyft2.mp3_76fb3869d4400dd7c8887ca9e601f5e6_18196451 |	Launch Uber X pretty pretty soon after.
EDL	00:04:02,944	00:04:04,736	| 20181127_hibt_lyft2.mp3_76fb3869d4400dd7c8887ca9e601f5e6_18196451 |	And what's more about that because in some ways
EDL	00:04:05,248	00:04:06,272	| 20181127_hibt_lyft2.mp3_76fb3869d4400dd7c8887ca9e601f5e6_18196451 |	The story of Lyft
EDL	00:04:06,784	00:04:10,112	| 20181127_hibt_lyft2.mp3_76fb3869d4400dd7c8887ca9e601f5e6_18196451 |	Slightly early story of left is probably about your competition with Uber
EDL	00:04:10,624	00:04:12,160	| 20181127_hibt_lyft2.mp3_76fb3869d4400dd7c8887ca9e601f5e6_18196451 |	Backwood when that happened
EDL	00:04:12,160	00:04:15,488	| 20181127_hibt_lyft2.mp3_76fb3869d4400dd7c8887ca9e601f5e6_18196451 |	Cuz they were bigger than you and still are a little bit today
EDL	00:04:16,512	00:04:17,536	| 20181127_hibt_lyft2.mp3_76fb3869d4400dd7c8887ca9e601f5e6_18196451 |	How are you are you about that
EDL	00:04:18,047	00:04:18,559	| 20181127_hibt_lyft2.mp3_76fb3869d4400dd7c8887ca9e601f5e6_18196451 |	Optician
EDL	00:04:19,327	00:04:20,351	| 20181127_hibt_lyft2.mp3_76fb3869d4400dd7c8887ca9e601f5e6_18196451 |	I will quite worried
EDL	00:04:20,863	00:04:23,423	| 20181127_hibt_lyft2.mp3_76fb3869d4400dd7c8887ca9e601f5e6_18196451 |	We started knowing what we were entering into
EDL	00:04:24,191	00:04:25,983	| 20181127_hibt_lyft2.mp3_76fb3869d4400dd7c8887ca9e601f5e6_18196451 |	So we knew we were The Underdogs from day one
EDL	00:04:26,495	00:04:28,543	| 20181127_hibt_lyft2.mp3_76fb3869d4400dd7c8887ca9e601f5e6_18196451 |	We we we did that you know with their eyes open
EDL	00:04:29,055	00:04:30,591	| 20181127_hibt_lyft2.mp3_76fb3869d4400dd7c8887ca9e601f5e6_18196451 |	We knew what we were taking on
EDL	00:04:30,591	00:04:32,383	| 20181127_hibt_lyft2.mp3_76fb3869d4400dd7c8887ca9e601f5e6_18196451 |	Whether it was Uber
EDL	00:04:32,383	00:04:34,175	| 20181127_hibt_lyft2.mp3_76fb3869d4400dd7c8887ca9e601f5e6_18196451 |	The taxi industry
EDL	00:04:34,687	00:04:35,967	| 20181127_hibt_lyft2.mp3_76fb3869d4400dd7c8887ca9e601f5e6_18196451 |	A small company with
EDL	00:04:35,967	00:04:36,991	| 20181127_hibt_lyft2.mp3_76fb3869d4400dd7c8887ca9e601f5e6_18196451 |	6 years ago
EDL	00:04:37,503	00:04:39,039	| 20181127_hibt_lyft2.mp3_76fb3869d4400dd7c8887ca9e601f5e6_18196451 |	Maybe in five years ago we're about 30
EDL	00:04:40,831	00:04:41,855	| 20181127_hibt_lyft2.mp3_76fb3869d4400dd7c8887ca9e601f5e6_18196451 |	How many people you know
EDL	00:04:41,855	00:04:42,879	| 20181127_hibt_lyft2.mp3_76fb3869d4400dd7c8887ca9e601f5e6_18196451 |	I almost 5000
EDL	00:04:43,647	00:04:46,975	| 20181127_hibt_lyft2.mp3_76fb3869d4400dd7c8887ca9e601f5e6_18196451 |	Five years ago you would 30 people you 5000 today
EDL	00:04:47,743	00:04:51,327	| 20181127_hibt_lyft2.mp3_76fb3869d4400dd7c8887ca9e601f5e6_18196451 |	Say that we knew it we were we were getting into and indefinitely
EDL	00:04:51,327	00:04:52,351	| 20181127_hibt_lyft2.mp3_76fb3869d4400dd7c8887ca9e601f5e6_18196451 |	That was concerning at 10
EDL	00:04:53,375	00:04:55,679	| 20181127_hibt_lyft2.mp3_76fb3869d4400dd7c8887ca9e601f5e6_18196451 |	But I mean this became almost like a blood
EDL	00:04:55,679	00:05:01,567	| 20181127_hibt_lyft2.mp3_76fb3869d4400dd7c8887ca9e601f5e6_18196451 |	Sport for some time right this competition between Uber and Lyft and it was really an Uber want to crush you guys
EDL	00:05:02,335	00:05:05,663	| 20181127_hibt_lyft2.mp3_76fb3869d4400dd7c8887ca9e601f5e6_18196451 |	How did you how did you deal with that like how did you deal with that just for me
EDL	00:05:06,175	00:05:07,455	| 20181127_hibt_lyft2.mp3_76fb3869d4400dd7c8887ca9e601f5e6_18196451 |	You know the stress level
EDL	00:05:07,967	00:05:08,991	| 20181127_hibt_lyft2.mp3_76fb3869d4400dd7c8887ca9e601f5e6_18196451 |	It was very hard
EDL	00:05:08,991	00:05:11,807	| 20181127_hibt_lyft2.mp3_76fb3869d4400dd7c8887ca9e601f5e6_18196451 |	I have amazing co-founder Logan green
EDL	00:05:11,807	00:05:13,087	| 20181127_hibt_lyft2.mp3_76fb3869d4400dd7c8887ca9e601f5e6_18196451 |	Who's there
EDL	00:05:13,087	00:05:14,879	| 20181127_hibt_lyft2.mp3_76fb3869d4400dd7c8887ca9e601f5e6_18196451 |	We don't know each other before you start working
EDL	00:05:15,647	00:05:18,207	| 20181127_hibt_lyft2.mp3_76fb3869d4400dd7c8887ca9e601f5e6_18196451 |	There's a lot of stories are friends who start things together
EDL	00:05:18,207	00:05:20,255	| 20181127_hibt_lyft2.mp3_76fb3869d4400dd7c8887ca9e601f5e6_18196451 |	That we started something together and became friends
EDL	00:05:22,047	00:05:23,327	| 20181127_hibt_lyft2.mp3_76fb3869d4400dd7c8887ca9e601f5e6_18196451 |	I have a great wife
EDL	00:05:23,327	00:05:27,423	| 20181127_hibt_lyft2.mp3_76fb3869d4400dd7c8887ca9e601f5e6_18196451 |	Who is very supportive but it was it was very difficult we woke up one day
EDL	00:05:27,423	00:05:28,447	| 20181127_hibt_lyft2.mp3_76fb3869d4400dd7c8887ca9e601f5e6_18196451 |	It was about
EDL	00:05:28,447	00:05:29,727	| 20181127_hibt_lyft2.mp3_76fb3869d4400dd7c8887ca9e601f5e6_18196451 |	For 5 years ago
EDL	00:05:30,239	00:05:32,287	| 20181127_hibt_lyft2.mp3_76fb3869d4400dd7c8887ca9e601f5e6_18196451 |	An Uber has raised 3 billion dollars
EDL	00:05:33,311	00:05:34,335	| 20181127_hibt_lyft2.mp3_76fb3869d4400dd7c8887ca9e601f5e6_18196451 |	And we had
EDL	00:05:34,335	00:05:36,383	| 20181127_hibt_lyft2.mp3_76fb3869d4400dd7c8887ca9e601f5e6_18196451 |	$109 left in the bank which is
EDL	00:05:36,383	00:05:37,407	| 20181127_hibt_lyft2.mp3_76fb3869d4400dd7c8887ca9e601f5e6_18196451 |	A lot of money
EDL	00:05:37,919	00:05:39,455	| 20181127_hibt_lyft2.mp3_76fb3869d4400dd7c8887ca9e601f5e6_18196451 |	But only a few more months left
EDL	00:05:39,967	00:05:42,783	| 20181127_hibt_lyft2.mp3_76fb3869d4400dd7c8887ca9e601f5e6_18196451 |	And now you have this crazy competitor who wants to
EDL	00:05:42,783	00:05:44,319	| 20181127_hibt_lyft2.mp3_76fb3869d4400dd7c8887ca9e601f5e6_18196451 |	The kill you
EDL	00:05:44,831	00:05:48,927	| 20181127_hibt_lyft2.mp3_76fb3869d4400dd7c8887ca9e601f5e6_18196451 |	. that was definitely definitely tough but I think we
EDL	00:05:48,927	00:05:51,231	| 20181127_hibt_lyft2.mp3_76fb3869d4400dd7c8887ca9e601f5e6_18196451 |	We stayed focused on our values we
EDL	00:05:51,231	00:05:52,511	| 20181127_hibt_lyft2.mp3_76fb3869d4400dd7c8887ca9e601f5e6_18196451 |	Stay focused on our
EDL	00:05:53,023	00:05:54,559	| 20181127_hibt_lyft2.mp3_76fb3869d4400dd7c8887ca9e601f5e6_18196451 |	Our vision and our mission
EDL	00:05:54,559	00:05:57,887	| 20181127_hibt_lyft2.mp3_76fb3869d4400dd7c8887ca9e601f5e6_18196451 |	And and just put our heads down and executed and tried our best not to
EDL	00:05:57,887	00:05:58,911	| 20181127_hibt_lyft2.mp3_76fb3869d4400dd7c8887ca9e601f5e6_18196451 |	Got distracted
EDL	00:05:59,423	00:06:01,471	| 20181127_hibt_lyft2.mp3_76fb3869d4400dd7c8887ca9e601f5e6_18196451 |	A lot of people here are building
EDL	00:06:01,471	00:06:03,263	| 20181127_hibt_lyft2.mp3_76fb3869d4400dd7c8887ca9e601f5e6_18196451 |	AR building ideas
EDL	00:06:03,263	00:06:07,615	| 20181127_hibt_lyft2.mp3_76fb3869d4400dd7c8887ca9e601f5e6_18196451 |	That will inevitably attract copycats inevitably attract competitors even even
EDL	00:06:08,383	00:06:10,687	| 20181127_hibt_lyft2.mp3_76fb3869d4400dd7c8887ca9e601f5e6_18196451 |	Brutal competitors
EDL	00:06:10,687	00:06:14,015	| 20181127_hibt_lyft2.mp3_76fb3869d4400dd7c8887ca9e601f5e6_18196451 |	What have you learned about your competition with Uber that might
EDL	00:06:14,015	00:06:15,551	| 20181127_hibt_lyft2.mp3_76fb3869d4400dd7c8887ca9e601f5e6_18196451 |	Help someone
EDL	00:06:15,551	00:06:16,319	| 20181127_hibt_lyft2.mp3_76fb3869d4400dd7c8887ca9e601f5e6_18196451 |	Figure out
EDL	00:06:16,831	00:06:18,879	| 20181127_hibt_lyft2.mp3_76fb3869d4400dd7c8887ca9e601f5e6_18196451 |	How to deal with in with their own competitors
EDL	00:06:19,647	00:06:20,671	| 20181127_hibt_lyft2.mp3_76fb3869d4400dd7c8887ca9e601f5e6_18196451 |	That's what you think back five
EDL	00:06:21,183	00:06:22,719	| 20181127_hibt_lyft2.mp3_76fb3869d4400dd7c8887ca9e601f5e6_18196451 |	5 years ago everyone said we were
EDL	00:06:23,487	00:06:26,303	| 20181127_hibt_lyft2.mp3_76fb3869d4400dd7c8887ca9e601f5e6_18196451 |	Right I mean if you look at the odds 3 billion dollars
EDL	00:06:26,303	00:06:27,839	| 20181127_hibt_lyft2.mp3_76fb3869d4400dd7c8887ca9e601f5e6_18196451 |	A a strong competitor
EDL	00:06:28,351	00:06:30,655	| 20181127_hibt_lyft2.mp3_76fb3869d4400dd7c8887ca9e601f5e6_18196451 |	Add Network effects as part of the business
EDL	00:06:30,655	00:06:31,423	| 20181127_hibt_lyft2.mp3_76fb3869d4400dd7c8887ca9e601f5e6_18196451 |	But
EDL	00:06:31,423	00:06:32,447	| 20181127_hibt_lyft2.mp3_76fb3869d4400dd7c8887ca9e601f5e6_18196451 |	But values do matter
EDL	00:06:32,959	00:06:34,751	| 20181127_hibt_lyft2.mp3_76fb3869d4400dd7c8887ca9e601f5e6_18196451 |	Treating people well does matter
EDL	00:06:34,751	00:06:36,287	| 20181127_hibt_lyft2.mp3_76fb3869d4400dd7c8887ca9e601f5e6_18196451 |	And having a mission that
EDL	00:06:36,799	00:06:38,591	| 20181127_hibt_lyft2.mp3_76fb3869d4400dd7c8887ca9e601f5e6_18196451 |	You focus on and
EDL	00:06:38,591	00:06:40,895	| 20181127_hibt_lyft2.mp3_76fb3869d4400dd7c8887ca9e601f5e6_18196451 |	Care about more deeply than someone else
EDL	00:06:40,895	00:06:41,919	| 20181127_hibt_lyft2.mp3_76fb3869d4400dd7c8887ca9e601f5e6_18196451 |	In the end
EDL	00:06:41,919	00:06:42,431	| 20181127_hibt_lyft2.mp3_76fb3869d4400dd7c8887ca9e601f5e6_18196451 |	Really matters
EDL	00:06:43,199	00:06:44,991	| 20181127_hibt_lyft2.mp3_76fb3869d4400dd7c8887ca9e601f5e6_18196451 |	So I would just say
EDL	00:06:44,991	00:06:47,039	| 20181127_hibt_lyft2.mp3_76fb3869d4400dd7c8887ca9e601f5e6_18196451 |	Focus on what you can control
EDL	00:06:47,039	00:06:48,575	| 20181127_hibt_lyft2.mp3_76fb3869d4400dd7c8887ca9e601f5e6_18196451 |	And there aren't there are good forces at
EDL	00:06:49,343	00:06:52,927	| 20181127_hibt_lyft2.mp3_76fb3869d4400dd7c8887ca9e601f5e6_18196451 |	And how did the dynamic between you you and Logan work like how did you win
EDL	00:06:53,439	00:06:54,975	| 20181127_hibt_lyft2.mp3_76fb3869d4400dd7c8887ca9e601f5e6_18196451 |	It sounds like what you're saying is
EDL	00:06:55,487	00:06:57,023	| 20181127_hibt_lyft2.mp3_76fb3869d4400dd7c8887ca9e601f5e6_18196451 |	He was kind of a steady
EDL	00:06:57,791	00:06:58,559	| 20181127_hibt_lyft2.mp3_76fb3869d4400dd7c8887ca9e601f5e6_18196451 |	You know
EDL	00:06:58,559	00:07:00,351	| 20181127_hibt_lyft2.mp3_76fb3869d4400dd7c8887ca9e601f5e6_18196451 |	Comforce and you are sort of
EDL	00:07:00,863	00:07:04,191	| 20181127_hibt_lyft2.mp3_76fb3869d4400dd7c8887ca9e601f5e6_18196451 |	A little bit freaking out you would like to freak out person
EDL	00:07:05,983	00:07:07,775	| 20181127_hibt_lyft2.mp3_76fb3869d4400dd7c8887ca9e601f5e6_18196451 |	I think in simplistic terms as reasonable
EDL	00:07:09,567	00:07:10,335	| 20181127_hibt_lyft2.mp3_76fb3869d4400dd7c8887ca9e601f5e6_18196451 |	He's
EDL	00:07:10,335	00:07:11,871	| 20181127_hibt_lyft2.mp3_76fb3869d4400dd7c8887ca9e601f5e6_18196451 |	I'm I'm more emotional
EDL	00:07:11,871	00:07:12,895	| 20181127_hibt_lyft2.mp3_76fb3869d4400dd7c8887ca9e601f5e6_18196451 |	He's more logical
EDL	00:07:13,407	00:07:15,455	| 20181127_hibt_lyft2.mp3_76fb3869d4400dd7c8887ca9e601f5e6_18196451 |	But I think it's fair to say there are moments where we both
EDL	00:07:16,479	00:07:17,759	| 20181127_hibt_lyft2.mp3_76fb3869d4400dd7c8887ca9e601f5e6_18196451 |	Did you ever think that
EDL	00:07:17,759	00:07:20,063	| 20181127_hibt_lyft2.mp3_76fb3869d4400dd7c8887ca9e601f5e6_18196451 |	I mean what you said people thought we were going to
EDL	00:07:20,063	00:07:21,855	| 20181127_hibt_lyft2.mp3_76fb3869d4400dd7c8887ca9e601f5e6_18196451 |	We were going to be crushed really finished
EDL	00:07:22,623	00:07:24,927	| 20181127_hibt_lyft2.mp3_76fb3869d4400dd7c8887ca9e601f5e6_18196451 |	Did a part of you ever worry that that might happen
