EDL	Record In	Record Out	Clipname	Subtitle
EDL	00:00:01,024	00:00:03,840	| 01-99-Percent-Noise |	99percentinvisible is brought to you by Progressive
EDL	00:00:03,840	00:00:06,144	| 01-99-Percent-Noise |	One of the country's leading providers of auto insurance
EDL	00:00:06,656	00:00:08,960	| 01-99-Percent-Noise |	With progressives Name Your Price tool
EDL	00:00:08,960	00:00:15,104	| 01-99-Percent-Noise |	You can say what kind of coverage were looking for and how much you want to pay and Progressive will show you options that fit within your budget
EDL	00:00:15,616	00:00:18,944	| 01-99-Percent-Noise |	Use the Name Your Price tool and start an online quote today
EDL	00:00:18,944	00:00:19,968	| 01-99-Percent-Noise |	Progressive.com
EDL	00:00:20,480	00:00:22,784	| 01-99-Percent-Noise |	Price in coverage match limited by state law
EDL	00:00:24,832	00:00:25,600	| 01-99-Percent-Noise |	Family ghosts
EDL	00:00:25,600	00:00:31,232	| 01-99-Percent-Noise |	Is a podcast explores all the unexpected ways our family structure and shape our view of the world
EDL	00:00:31,744	00:00:33,280	| 01-99-Percent-Noise |	Each episode of Family ghost
EDL	00:00:33,280	00:00:37,376	| 01-99-Percent-Noise |	Takes a look at the story behind a different person's family lore
EDL	00:00:37,376	00:00:40,192	| 01-99-Percent-Noise |	Digging into unanswered questions about their history
EDL	00:00:40,192	00:00:46,080	| 01-99-Percent-Noise |	Season 2 Launches on May 15th featuring an episode where they take you inside the love Israel family called
EDL	00:00:46,080	00:00:50,688	| 01-99-Percent-Noise |	An episode about uncovering the secrets scrolled in a newly discovered stack of Love Letters
EDL	00:00:50,688	00:00:57,088	| 01-99-Percent-Noise |	Asuna episode that brings you along to the hunt for a container of missing Chinese food that's haunted a family
EDL	00:00:57,088	00:00:58,368	| 01-99-Percent-Noise |	For 25 years
EDL	00:00:58,368	00:00:58,880	| 01-99-Percent-Noise |	And more
EDL	00:00:59,392	00:01:03,488	| 01-99-Percent-Noise |	Subscribe to family goes wherever you get your podcast and find out why they say
EDL	00:01:03,488	00:01:04,768	| 01-99-Percent-Noise |	Every house is haunted
EDL	00:01:06,304	00:01:09,632	| 01-99-Percent-Noise |	We get support from UC Davis globally ranked University
EDL	00:01:09,632	00:01:15,264	| 01-99-Percent-Noise |	Working to solve the world's most pressing problems and food energy health education and the environment
EDL	00:01:15,264	00:01:21,152	| 01-99-Percent-Noise |	UC Davis researchers collaborate and innovate in California and around the globe Define transformational Solutions
EDL	00:01:21,664	00:01:25,504	| 01-99-Percent-Noise |	Quality of life for all living things
EDL	00:01:25,504	00:01:29,344	| 01-99-Percent-Noise |	Find out more at 21st century. Ucdavis.edu
EDL	00:01:34,720	00:01:36,256	| 01-99-Percent-Noise |	Visit 99 percent invisible
EDL	00:01:36,256	00:01:37,280	| 01-99-Percent-Noise |	I'm Roman Mars
EDL	00:01:37,792	00:01:41,376	| 01-99-Percent-Noise |	Here at the San Francisco Main Library
EDL	00:01:42,144	00:01:46,752	| 01-99-Percent-Noise |	And that is Dennis paoletti you walk into the library as a five-story atrium
EDL	00:01:47,776	00:01:49,312	| 01-99-Percent-Noise |	He's an acoustic designer
EDL	00:01:50,336	00:01:53,408	| 01-99-Percent-Noise |	And it also is very hard and reflect
EDL	00:01:53,408	00:01:54,432	| 01-99-Percent-Noise |	All of the
EDL	00:01:54,432	00:01:57,248	| 01-99-Percent-Noise |	Plaster concrete reflective material
EDL	00:01:57,248	00:01:59,552	| 01-99-Percent-Noise |	Companies hire him to make their buildings
EDL	00:01:59,552	00:02:00,576	| 01-99-Percent-Noise |	And boardrooms
EDL	00:02:00,576	00:02:01,856	| 01-99-Percent-Noise |	In cathedrals
EDL	00:02:01,856	00:02:03,136	| 01-99-Percent-Noise |	And public spaces
EDL	00:02:03,136	00:02:04,160	| 01-99-Percent-Noise |	Sound better
EDL	00:02:04,160	00:02:10,560	| 01-99-Percent-Noise |	When an early scheme had the architect had the main information desk bright in the
EDL	00:02:10,560	00:02:11,328	| 01-99-Percent-Noise |	Little Havana
EDL	00:02:11,328	00:02:14,144	| 01-99-Percent-Noise |	Floor plan in the center of that five-story atrium
EDL	00:02:14,656	00:02:16,704	| 01-99-Percent-Noise |	The commotion that would go on
EDL	00:02:17,216	00:02:19,008	| 01-99-Percent-Noise |	It would be disastrous for
EDL	00:02:19,520	00:02:22,336	| 01-99-Percent-Noise |	People had to work there to try to hear
EDL	00:02:22,848	00:02:24,384	| 01-99-Percent-Noise |	The visitors coming in asking for
EDL	00:02:24,896	00:02:25,664	| 01-99-Percent-Noise |	Trying to communicate
EDL	00:02:29,504	00:02:32,064	| 01-99-Percent-Noise |	One of the things we recommend was it just
EDL	00:02:32,064	00:02:33,856	| 01-99-Percent-Noise |	Bad information desk
EDL	00:02:35,904	00:02:36,672	| 01-99-Percent-Noise |	Of the atrium
EDL	00:02:37,184	00:02:38,208	| 01-99-Percent-Noise |	Tuck it under
EDL	00:02:38,208	00:02:38,976	| 01-99-Percent-Noise |	Some of the mezzanine
EDL	00:02:39,488	00:02:40,512	| 01-99-Percent-Noise |	Pretty simple
EDL	00:02:40,512	00:02:41,536	| 01-99-Percent-Noise |	Pretty minor but
EDL	00:02:41,536	00:02:43,840	| 01-99-Percent-Noise |	To make this made such a big Improvement
EDL	00:02:43,840	00:02:44,608	| 01-99-Percent-Noise |	I would like that
EDL	00:02:49,216	00:02:53,824	| 01-99-Percent-Noise |	Set smart and Simple Choice to tuck the information desk over to the left side
EDL	00:02:53,824	00:02:56,384	| 01-99-Percent-Noise |	So patrons and Librarians could actually hear each other
EDL	00:02:56,896	00:02:57,408	| 01-99-Percent-Noise |	Created the
EDL	00:02:57,920	00:02:58,944	| 01-99-Percent-Noise |	Wide open
EDL	00:02:59,456	00:03:00,480	| 01-99-Percent-Noise |	Circular entryway
EDL	00:03:00,992	00:03:02,784	| 01-99-Percent-Noise |	And no one really knows how to walk
EDL	00:03:04,064	00:03:05,344	| 01-99-Percent-Noise |	Bumping into someone else
EDL	00:03:05,856	00:03:07,136	| 01-99-Percent-Noise |	So this beautiful
EDL	00:03:07,136	00:03:10,464	| 01-99-Percent-Noise |	140 million dollar building has an added feature
EDL	00:03:10,976	00:03:13,792	| 01-99-Percent-Noise |	That certainly was not on the architect's plans
EDL	00:03:13,792	00:03:14,304	| 01-99-Percent-Noise |	It's a hat
EDL	00:03:15,072	00:03:16,096	| 01-99-Percent-Noise |	Jankity
EDL	00:03:16,096	00:03:18,144	| 01-99-Percent-Noise |	Retractable movie theaters
EDL	00:03:18,144	00:03:19,936	| 01-99-Percent-Noise |	Hairstyle Velvet Rope partition
EDL	00:03:20,448	00:03:21,216	| 01-99-Percent-Noise |	Helps
EDL	00:03:21,216	00:03:22,496	| 01-99-Percent-Noise |	Create the proper traffic
EDL	00:03:23,520	00:03:25,824	| 01-99-Percent-Noise |	And right there are 15 feet apart from one another
EDL	00:03:26,336	00:03:27,104	| 01-99-Percent-Noise |	A minor Triumph
EDL	00:03:27,616	00:03:28,640	| 01-99-Percent-Noise |	And a minor failure
EDL	00:03:29,152	00:03:29,664	| 01-99-Percent-Noise |	Of design
EDL	00:03:37,344	00:03:38,368	| 01-99-Percent-Noise |	In the Epic of Gilgamesh
EDL	00:03:38,880	00:03:40,416	| 01-99-Percent-Noise |	The god gets so infuriated
EDL	00:03:40,928	00:03:41,952	| 01-99-Percent-Noise |	With annoying
EDL	00:03:41,952	00:03:42,976	| 01-99-Percent-Noise |	Cast of their human Neighbors
EDL	00:03:43,488	00:03:45,280	| 01-99-Percent-Noise |	If they send a flood to wipe us all out
EDL	00:03:46,560	00:03:47,840	| 01-99-Percent-Noise |	And when you walk around the city
EDL	00:03:48,608	00:03:49,376	| 01-99-Percent-Noise |	Pretty easy day
EDL	00:03:49,888	00:03:51,936	| 01-99-Percent-Noise |	Side with the Gods in that scenario
EDL	00:03:51,936	00:03:52,704	| 01-99-Percent-Noise |	What is noise
EDL	00:03:53,216	00:03:55,520	| 01-99-Percent-Noise |	Noise very simply is unwanted
EDL	00:03:55,520	00:03:56,032	| 01-99-Percent-Noise |	Sound
EDL	00:03:57,056	00:03:59,616	| 01-99-Percent-Noise |	Did used to be called environmental noise
EDL	00:04:01,664	00:04:03,968	| 01-99-Percent-Noise |	People are beginning to get interested in looking at
EDL	00:04:03,968	00:04:05,248	| 01-99-Percent-Noise |	The city's environment
EDL	00:04:05,248	00:04:06,528	| 01-99-Percent-Noise |	Has something unique to that
EDL	00:04:07,296	00:04:08,832	| 01-99-Percent-Noise |	In San Francisco
EDL	00:04:08,832	00:04:11,904	| 01-99-Percent-Noise |	The cable cars are always interesting point of
EDL	00:04:11,904	00:04:14,720	| 01-99-Percent-Noise |	Discussion is that sound or is that noise
EDL	00:04:14,720	00:04:16,768	| 01-99-Percent-Noise |	Well for tourism business examples
EDL	00:04:17,791	00:04:24,191	| 01-99-Percent-Noise |	That sound that's good that's money but believe it or not we've been called into people who are annoyed
EDL	00:04:24,191	00:04:26,751	| 01-99-Percent-Noise |	Goodbye the sound of those planking Bells
EDL	00:04:26,751	00:04:29,055	| 01-99-Percent-Noise |	Or the cables that run under the street
EDL	00:04:29,567	00:04:32,895	| 01-99-Percent-Noise |	The job of acoustic design is not just to make things quieter
EDL	00:04:32,895	00:04:36,223	| 01-99-Percent-Noise |	Sometimes the best way to design a space to have less noise
EDL	00:04:36,223	00:04:39,295	| 01-99-Percent-Noise |	If the add more sound a reading room in a library
EDL	00:04:39,295	00:04:40,063	| 01-99-Percent-Noise |	Quiet quiet
EDL	00:04:40,063	00:04:41,343	| 01-99-Percent-Noise |	It is so quiet
EDL	00:04:42,367	00:04:43,391	| 01-99-Percent-Noise |	Anybody
EDL	00:04:43,391	00:04:47,487	| 01-99-Percent-Noise |	Flipping a page in a book turns out to distract everybody else
EDL	00:04:47,487	00:04:49,279	| 01-99-Percent-Noise |	The problem acoustically
EDL	00:04:49,279	00:04:50,815	| 01-99-Percent-Noise |	The background noise level
EDL	00:04:51,583	00:04:53,119	| 01-99-Percent-Noise |	It's literally too quiet
EDL	00:04:53,631	00:04:57,727	| 01-99-Percent-Noise |	We often come into spaces like that and add background noise
EDL	00:04:58,751	00:05:02,847	| 01-99-Percent-Noise |	And that's why small parks and cities usually have fountains and if they don't they need one
EDL	00:05:03,359	00:05:04,895	| 01-99-Percent-Noise |	They may be visually pleasing
EDL	00:05:04,895	00:05:06,943	| 01-99-Percent-Noise |	The sound might even matter more
EDL	00:05:06,943	00:05:08,223	| 01-99-Percent-Noise |	Fountains give you this
EDL	00:05:08,735	00:05:10,783	| 01-99-Percent-Noise |	Comfort level of acoustical privacy
EDL	00:05:11,551	00:05:12,575	| 01-99-Percent-Noise |	Masking
EDL	00:05:13,087	00:05:14,623	| 01-99-Percent-Noise |	Unwanted noise
EDL	00:05:15,647	00:05:16,671	| 01-99-Percent-Noise |	What's your noise
EDL	00:05:16,671	00:05:18,207	| 01-99-Percent-Noise |	China Merchants Bank
EDL	00:05:18,207	00:05:19,743	| 01-99-Percent-Noise |	When I'm home in
EDL	00:05:19,743	00:05:21,535	| 01-99-Percent-Noise |	That's my place to relax
EDL	00:05:21,535	00:05:24,351	| 01-99-Percent-Noise |	The neighbors always start mowing the lawn
EDL	00:05:25,887	00:05:27,679	| 01-99-Percent-Noise |	Thorax Anatomy the days to listen
EDL	00:05:28,191	00:05:29,983	| 01-99-Percent-Noise |	Little people people are annoying
EDL	00:05:29,983	00:05:32,799	| 01-99-Percent-Noise |	Listen to the city and let me know what's your favorite sound
EDL	00:05:32,799	00:05:33,567	| 01-99-Percent-Noise |	And what's your noise
EDL	00:05:34,079	00:05:36,127	| 01-99-Percent-Noise |	And how is it enhanced or drowned out by
EDL	00:05:36,127	00:05:37,919	| 01-99-Percent-Noise |	The design of the city that you live in
EDL	00:05:37,919	00:05:39,967	| 01-99-Percent-Noise |	But the building where you spend most of your time
EDL	00:05:39,967	00:05:42,783	| 01-99-Percent-Noise |	Leave your comments at 99% invisible. Org
EDL	00:05:44,063	00:05:50,207	| 01-99-Percent-Noise |	99% invisible is produced by me Roman Mars and support from lunar design as a product of kalw the America
EDL	00:05:50,719	00:05:51,231	| 01-99-Percent-Noise |	Steve architect
EDL	00:05:51,743	00:05:52,511	| 01-99-Percent-Noise |	Francisco
EDL	00:05:52,511	00:05:53,023	| 01-99-Percent-Noise |	Rent-A-Center
EDL	00:05:55,839	00:05:58,143	| 01-99-Percent-Noise |	Before we go I want to tell you about the body Genie
EDL	00:05:58,655	00:06:01,983	| 01-99-Percent-Noise |	Series from Bellow radio TV show the truth
EDL	00:06:02,495	00:06:06,335	| 01-99-Percent-Noise |	The bunny genius is a Dark comic mystery that whines through a
EDL	00:06:06,335	00:06:08,383	| 01-99-Percent-Noise |	Treacherous fictionalized Hollywood
EDL	00:06:08,383	00:06:09,919	| 01-99-Percent-Noise |	We're looking the part
EDL	00:06:09,919	00:06:11,455	| 01-99-Percent-Noise |	Might cost you your life
EDL	00:06:11,455	00:06:16,831	| 01-99-Percent-Noise |	You know how sometimes a famous actor has to get really jacked play superhero in a movie
EDL	00:06:16,831	00:06:20,671	| 01-99-Percent-Noise |	What is a ton of weight to play a prisoner or a psychopath
EDL	00:06:21,183	00:06:25,279	| 01-99-Percent-Noise |	Or put on 50lb all of a sudden to play like a dad
EDL	00:06:26,815	00:06:29,887	| 01-99-Percent-Noise |	I'm a Hollywood trainer and I specialize in that stuff
EDL	00:06:29,887	00:06:33,983	| 01-99-Percent-Noise |	Actually if I'm being honest I'm one of the main guys who knows how to do that kind of
EDL	00:06:35,263	00:06:41,407	| 01-99-Percent-Noise |	A few days ago Wesley Stern and actor that I was helping to get huge for an action movie called Immortal cop
EDL	00:06:41,919	00:06:44,991	| 01-99-Percent-Noise |	Was found dead in my private gym
EDL	00:06:44,991	00:06:48,319	| 01-99-Percent-Noise |	Crushed inside a high-tech weight machine
EDL	00:06:48,319	00:06:52,671	| 01-99-Percent-Noise |	Even worse the cops think that I had something to do with it
EDL	00:06:52,671	00:06:55,999	| 01-99-Percent-Noise |	Now I need to clear my name
EDL	00:06:55,999	00:07:01,375	| 01-99-Percent-Noise |	Somebody out there killed Wesley and I'm going to do whatever it takes
EDL	00:07:01,375	00:07:02,143	| 01-99-Percent-Noise |	To find them
EDL	00:07:04,959	00:07:10,591	| 01-99-Percent-Noise |	Final episode of the body genius drops on May 30th Bend all 5 Parts on the truth podcast
EDL	00:07:10,591	00:07:11,103	| 01-99-Percent-Noise |	Dot-com 
