EDL	Record In	Record Out	Clipname	Subtitle
EDL	00:00:01,024	00:00:03,840	| 99pi-0082-themanoftomorrow-1 |	99percentinvisible is brought to you by Progressive
EDL	00:00:03,840	00:00:06,656	| 99pi-0082-themanoftomorrow-1 |	One of the country's leading providers of auto insurance
EDL	00:00:06,656	00:00:08,960	| 99pi-0082-themanoftomorrow-1 |	With progressives Name Your Price tool
EDL	00:00:08,960	00:00:15,104	| 99pi-0082-themanoftomorrow-1 |	You can say what kind of coverage were looking for and how much you want to pay and Progressive will show you options that fit within your budget
EDL	00:00:15,616	00:00:18,944	| 99pi-0082-themanoftomorrow-1 |	Use the Name Your Price tool and start an online quote today
EDL	00:00:18,944	00:00:19,968	| 99pi-0082-themanoftomorrow-1 |	Progressive.com
EDL	00:00:20,480	00:00:22,784	| 99pi-0082-themanoftomorrow-1 |	Price in coverage match limited by state law
EDL	00:00:24,064	00:00:30,464	| 99pi-0082-themanoftomorrow-1 |	When it comes to marketing your business it's all about reaching the Right audience at the right time and connecting with that on
EDL	00:00:30,464	00:00:34,048	| 99pi-0082-themanoftomorrow-1 |	When your message will resonate the most LinkedIn can help
EDL	00:00:34,048	00:00:40,448	| 99pi-0082-themanoftomorrow-1 |	Lincoln is the world's largest Professional Network in LinkedIn marketing Solutions allow you to Target your customers
EDL	00:00:40,448	00:00:44,544	| 99pi-0082-themanoftomorrow-1 |	Weather in beijing every day when they're ready to make a decision
EDL	00:00:44,544	00:00:50,944	| 99pi-0082-themanoftomorrow-1 |	When you advertise on LinkedIn you have the opportunity to build long-term relationships with their customers those relationships often
EDL	00:00:50,944	00:00:57,344	| 99pi-0082-themanoftomorrow-1 |	Turn into high-quality leads website traffic and higher brand awareness and Linkedin have the marking tools
EDL	00:00:57,344	00:00:59,904	| 99pi-0082-themanoftomorrow-1 |	Help you target your customers with precision
EDL	00:00:59,904	00:01:06,304	| 99pi-0082-themanoftomorrow-1 |	Down to the job title company name and Industry because we can Target exactly who you want to reach you can make sure
EDL	00:01:06,304	00:01:12,704	| 99pi-0082-themanoftomorrow-1 |	Customers are getting a message that they care about which in turn builds trust a free $100
EDL	00:01:12,704	00:01:19,104	| 99pi-0082-themanoftomorrow-1 |	Burlington add Credit in launching first campaign go to linkedin.com invisible up linkedin.com
EDL	00:01:19,104	00:01:22,176	| 99pi-0082-themanoftomorrow-1 |	Cam invisible Pier free $100 at credit
EDL	00:01:22,688	00:01:24,224	| 99pi-0082-themanoftomorrow-1 |	Terms and conditions apply
EDL	00:01:26,784	00:01:30,368	| 99pi-0082-themanoftomorrow-1 |	Your attention please this is 99% invisible
EDL	00:01:30,368	00:01:32,672	| 99pi-0082-themanoftomorrow-1 |	Resetting a new exciting radio program
EDL	00:01:37,536	00:01:38,304	| 99pi-0082-themanoftomorrow-1 |	I'm Roman Mars
EDL	00:01:53,152	00:01:58,528	| 99pi-0082-themanoftomorrow-1 |	I'm willing to concede from the get-go that I might be wrong about the entire premise of the story
EDL	00:01:58,528	00:02:02,368	| 99pi-0082-themanoftomorrow-1 |	But Superman has never really worked for me as a character
EDL	00:02:02,368	00:02:06,208	| 99pi-0082-themanoftomorrow-1 |	I prefer the more grounded Marvel comic book characters like
EDL	00:02:06,208	00:02:08,768	| 99pi-0082-themanoftomorrow-1 |	Spider-Man who lived in real cities
EDL	00:02:08,768	00:02:10,560	| 99pi-0082-themanoftomorrow-1 |	And human thoughts and feelings
EDL	00:02:11,072	00:02:12,864	| 99pi-0082-themanoftomorrow-1 |	Superman is basically
EDL	00:02:12,864	00:02:14,144	| 99pi-0082-themanoftomorrow-1 |	Invincible
EDL	00:02:14,144	00:02:15,424	| 99pi-0082-themanoftomorrow-1 |	Unrelatable
EDL	00:02:15,424	00:02:15,936	| 99pi-0082-themanoftomorrow-1 |	And
EDL	00:02:16,704	00:02:17,472	| 99pi-0082-themanoftomorrow-1 |	Used
EDL	00:02:17,984	00:02:19,008	| 99pi-0082-themanoftomorrow-1 |	Establishment
EDL	00:02:21,824	00:02:25,408	| 99pi-0082-themanoftomorrow-1 |	And even though I really love the first Christopher Reeve Superman movie
EDL	00:02:25,920	00:02:30,016	| 99pi-0082-themanoftomorrow-1 |	It contains a perfect example of why I don't really dig the character
EDL	00:02:30,016	00:02:34,624	| 99pi-0082-themanoftomorrow-1 |	The business a twenty-five-year-old spoiler alert but at the end of the 1978 movie
EDL	00:02:34,624	00:02:41,024	| 99pi-0082-themanoftomorrow-1 |	All the greatness of that film is nearly undone by the fundamental flaw of having a character that is all
EDL	00:02:41,024	00:02:42,560	| 99pi-0082-themanoftomorrow-1 |	Powerful than Superman
EDL	00:02:43,072	00:02:44,352	| 99pi-0082-themanoftomorrow-1 |	Flies around the Earth
EDL	00:02:44,352	00:02:45,376	| 99pi-0082-themanoftomorrow-1 |	Backwards
EDL	00:02:45,376	00:02:46,656	| 99pi-0082-themanoftomorrow-1 |	And turns back
EDL	00:02:46,656	00:02:47,168	| 99pi-0082-themanoftomorrow-1 |	Time
EDL	00:02:47,680	00:02:51,776	| 99pi-0082-themanoftomorrow-1 |	Person got to get clear is that he's not share
EDL	00:02:51,776	00:02:53,312	| 99pi-0082-themanoftomorrow-1 |	He doesn't turn back time
EDL	00:02:54,080	00:02:58,944	| 99pi-0082-themanoftomorrow-1 |	Superman one that's Glen Weldon father of Superman the unauthorized biography
EDL	00:02:59,456	00:03:01,248	| 99pi-0082-themanoftomorrow-1 |	Grasping for an explanation
EDL	00:03:03,296	00:03:04,832	| 99pi-0082-themanoftomorrow-1 |	Flies faster
EDL	00:03:04,832	00:03:05,344	| 99pi-0082-themanoftomorrow-1 |	Speed of light
EDL	00:03:06,112	00:03:06,880	| 99pi-0082-themanoftomorrow-1 |	Travels in time
EDL	00:03:06,880	00:03:09,696	| 99pi-0082-themanoftomorrow-1 |	So that's exactly what he's doing except he's just spinning round and round
EDL	00:03:11,744	00:03:13,280	| 99pi-0082-themanoftomorrow-1 |	So the reason everything goes
EDL	00:03:13,280	00:03:14,048	| 99pi-0082-themanoftomorrow-1 |	Backwards
EDL	00:03:14,048	00:03:15,072	| 99pi-0082-themanoftomorrow-1 |	He's not because he's actually
EDL	00:03:15,584	00:03:16,864	| 99pi-0082-themanoftomorrow-1 |	Spinning your ass backwards on it
EDL	00:03:16,864	00:03:18,400	| 99pi-0082-themanoftomorrow-1 |	Axis making time go
EDL	00:03:18,400	00:03:20,192	| 99pi-0082-themanoftomorrow-1 |	We're just watching
EDL	00:03:20,192	00:03:21,472	| 99pi-0082-themanoftomorrow-1 |	Kim travel back
EDL	00:03:21,472	00:03:23,008	| 99pi-0082-themanoftomorrow-1 |	In time we're seeing it through his eye
EDL	00:03:23,776	00:03:24,544	| 99pi-0082-themanoftomorrow-1 |	So that's what
EDL	00:03:24,544	00:03:29,152	| 99pi-0082-themanoftomorrow-1 |	What's going on this is my Wackadoo series that I'm going to a standby
EDL	00:03:29,664	00:03:30,944	| 99pi-0082-themanoftomorrow-1 |	Fork friendly
EDL	00:03:30,944	00:03:34,016	| 99pi-0082-themanoftomorrow-1 |	Despite the fact that there's some stuff in the in the movie that kind of
EDL	00:03:34,016	00:03:34,784	| 99pi-0082-themanoftomorrow-1 |	Contradict
EDL	00:03:34,784	00:03:40,928	| 99pi-0082-themanoftomorrow-1 |	I still plugged for this music that I'm talking over is from the Superman movie soundtrack you know what it's called it's called
EDL	00:03:41,440	00:03:42,976	| 99pi-0082-themanoftomorrow-1 |	Turning back the world
EDL	00:03:45,280	00:03:49,120	| 99pi-0082-themanoftomorrow-1 |	I'm teasing Glen Weldon because I feel like I know him because in addition to being
EDL	00:03:49,120	00:03:51,168	| 99pi-0082-themanoftomorrow-1 |	The unauthorized biography for a Superman
EDL	00:03:51,168	00:03:55,776	| 99pi-0082-themanoftomorrow-1 |	He's also a panelist on NPR's pop culture Happy Hour podcast which is
EDL	00:03:55,776	00:03:57,824	| 99pi-0082-themanoftomorrow-1 |	Great it comes out on Friday
EDL	00:03:57,824	00:03:58,848	| 99pi-0082-themanoftomorrow-1 |	I listen to it
EDL	00:03:59,360	00:04:00,128	| 99pi-0082-themanoftomorrow-1 |	Friday
EDL	00:04:01,152	00:04:04,992	| 99pi-0082-themanoftomorrow-1 |	So I got in touch with Clan because I thought if I can appreciate Superman as a character
EDL	00:04:05,760	00:04:07,296	| 99pi-0082-themanoftomorrow-1 |	Maybe I can appreciate him
EDL	00:04:07,296	00:04:08,320	| 99pi-0082-themanoftomorrow-1 |	As a design
EDL	00:04:08,832	00:04:11,648	| 99pi-0082-themanoftomorrow-1 |	A supremely successful design
EDL	00:04:11,648	00:04:15,488	| 99pi-0082-themanoftomorrow-1 |	And the first thing Glenn told me is that I need to dispense with this notion
EDL	00:04:15,488	00:04:16,512	| 99pi-0082-themanoftomorrow-1 |	That's Superman
EDL	00:04:16,512	00:04:18,047	| 99pi-0082-themanoftomorrow-1 |	Should be relatable
EDL	00:04:18,047	00:04:19,839	| 99pi-0082-themanoftomorrow-1 |	The thing you have to understand about Superman
EDL	00:04:19,839	00:04:20,607	| 99pi-0082-themanoftomorrow-1 |	Is that he was
EDL	00:04:21,119	00:04:22,143	| 99pi-0082-themanoftomorrow-1 |	Never intended
EDL	00:04:22,143	00:04:24,447	| 99pi-0082-themanoftomorrow-1 |	The character that we identify with
EDL	00:04:24,447	00:04:25,727	| 99pi-0082-themanoftomorrow-1 |	He's not a hero like Batman
EDL	00:04:25,727	00:04:27,263	| 99pi-0082-themanoftomorrow-1 |	Set a hero like Spiderman
EDL	00:04:27,263	00:04:27,775	| 99pi-0082-themanoftomorrow-1 |	Man who have
EDL	00:04:28,799	00:04:30,591	| 99pi-0082-themanoftomorrow-1 |	Psychological Hang-Ups that we recognize
EDL	00:04:30,591	00:04:31,103	| 99pi-0082-themanoftomorrow-1 |	Empathize
EDL	00:04:31,615	00:04:32,383	| 99pi-0082-themanoftomorrow-1 |	He's not the hero
EDL	00:04:32,895	00:04:34,175	| 99pi-0082-themanoftomorrow-1 |	We identify with
EDL	00:04:34,175	00:04:35,199	| 99pi-0082-themanoftomorrow-1 |	He's the hero
EDL	00:04:35,199	00:04:35,967	| 99pi-0082-themanoftomorrow-1 |	We believe in
EDL	00:04:36,479	00:04:39,039	| 99pi-0082-themanoftomorrow-1 |	Different he's an inspiration he supposed to be
EDL	00:04:39,039	00:04:39,551	| 99pi-0082-themanoftomorrow-1 |	Better than us
EDL	00:04:40,063	00:04:41,087	| 99pi-0082-themanoftomorrow-1 |	That's right there in the name
EDL	00:04:41,087	00:04:42,623	| 99pi-0082-themanoftomorrow-1 |	Movie called Superman for a reason
EDL	00:04:43,135	00:04:44,927	| 99pi-0082-themanoftomorrow-1 |	He exists to say
EDL	00:04:44,927	00:04:47,231	| 99pi-0082-themanoftomorrow-1 |	We can be better we can achieve these eyes
EDL	00:04:47,231	00:04:47,743	| 99pi-0082-themanoftomorrow-1 |	Ideals
EDL	00:04:49,791	00:04:54,143	| 99pi-0082-themanoftomorrow-1 |	There are so many things that the creators of Superman Jerry Siegel and Joe Shuster
EDL	00:04:54,143	00:04:58,751	| 99pi-0082-themanoftomorrow-1 |	Got right in the design is Superman from the very beginning the first thing they got right
EDL	00:04:59,263	00:05:00,287	| 99pi-0082-themanoftomorrow-1 |	Was being first
EDL	00:05:00,799	00:05:02,079	| 99pi-0082-themanoftomorrow-1 |	1st and Market
EDL	00:05:02,079	00:05:05,407	| 99pi-0082-themanoftomorrow-1 |	It difficult to pinpoint which character qualifies as the first
EDL	00:05:05,407	00:05:06,175	| 99pi-0082-themanoftomorrow-1 |	Superhero
EDL	00:05:06,687	00:05:09,759	| 99pi-0082-themanoftomorrow-1 |	Yoga Master Hercules or the Phantom or the clock
EDL	00:05:10,527	00:05:12,063	| 99pi-0082-themanoftomorrow-1 |	It's worth looking into the clock
EDL	00:05:12,063	00:05:13,855	| 99pi-0082-themanoftomorrow-1 |	But Superman is certainly
EDL	00:05:13,855	00:05:15,391	| 99pi-0082-themanoftomorrow-1 |	The first of a type
EDL	00:05:15,391	00:05:19,487	| 99pi-0082-themanoftomorrow-1 |	The dominated popular culture from the moment he debuted in 1938
EDL	00:05:19,999	00:05:21,023	| 99pi-0082-themanoftomorrow-1 |	Any idea
EDL	00:05:21,535	00:05:22,047	| 99pi-0082-themanoftomorrow-1 |	Was simple
EDL	00:05:22,559	00:05:25,631	| 99pi-0082-themanoftomorrow-1 |	Well he was created to be basically a circus strongman
EDL	00:05:25,631	00:05:26,399	| 99pi-0082-themanoftomorrow-1 |	What's that word
EDL	00:05:26,399	00:05:27,167	| 99pi-0082-themanoftomorrow-1 |	Design the costumes
EDL	00:05:28,191	00:05:31,519	| 99pi-0082-themanoftomorrow-1 |	And that's what Siegel and Shuster intended he was just like us
EDL	00:05:32,031	00:05:32,543	| 99pi-0082-themanoftomorrow-1 |	Only
EDL	00:05:33,055	00:05:34,335	| 99pi-0082-themanoftomorrow-1 |	Bigger stronger
EDL	00:05:34,335	00:05:36,895	| 99pi-0082-themanoftomorrow-1 |	Better so he could do everything that we could do
EDL	00:05:36,895	00:05:37,919	| 99pi-0082-themanoftomorrow-1 |	You only do it
EDL	00:05:37,919	00:05:39,455	| 99pi-0082-themanoftomorrow-1 |	More that's where the Superman ID
EDL	00:05:40,479	00:05:43,039	| 99pi-0082-themanoftomorrow-1 |	It's very simple that's why this character stuck around
EDL	00:05:43,551	00:05:45,087	| 99pi-0082-themanoftomorrow-1 |	Cuz the iconography of simple
EDL	00:05:45,087	00:05:49,439	| 99pi-0082-themanoftomorrow-1 |	Red blue and yellow even the color blind can see red blue and yellow that's that's important
EDL	00:05:49,439	00:05:52,255	| 99pi-0082-themanoftomorrow-1 |	You have to keep everything about this character as simple as possible
EDL	00:05:52,255	00:05:53,023	| 99pi-0082-themanoftomorrow-1 |	Couldn't fly at the
EDL	00:05:53,791	00:05:55,071	| 99pi-0082-themanoftomorrow-1 |	He denied any of the other sensory
EDL	00:05:56,095	00:05:59,679	| 99pi-0082-themanoftomorrow-1 |	He was at the guy that Siegel and Shuster would drop into the middle of a scene
EDL	00:06:00,191	00:06:00,959	| 99pi-0082-themanoftomorrow-1 |	With a bunch of fog
EDL	00:06:01,471	00:06:03,775	| 99pi-0082-themanoftomorrow-1 |	And they would try to attack him and he would shrug them off
EDL	00:06:03,775	00:06:06,335	| 99pi-0082-themanoftomorrow-1 |	This was the engine of the story this is where the
EDL	00:06:06,847	00:06:07,359	| 99pi-0082-themanoftomorrow-1 |	The adventures
EDL	00:06:07,871	00:06:08,639	| 99pi-0082-themanoftomorrow-1 |	Funnel
EDL	00:06:08,639	00:06:09,663	| 99pi-0082-themanoftomorrow-1 |	Those early stories came from
EDL	00:06:10,175	00:06:11,711	| 99pi-0082-themanoftomorrow-1 |	Just him showing over and over again
EDL	00:06:12,223	00:06:12,991	| 99pi-0082-themanoftomorrow-1 |	That he was wrong
EDL	00:06:14,271	00:06:17,087	| 99pi-0082-themanoftomorrow-1 |	Thundamentals Siegel and Shuster
EDL	00:06:17,599	00:06:20,671	| 99pi-0082-themanoftomorrow-1 |	Nailed it they did they created something great
EDL	00:06:20,671	00:06:21,439	| 99pi-0082-themanoftomorrow-1 |	And everyone knew it
EDL	00:06:21,951	00:06:23,487	| 99pi-0082-themanoftomorrow-1 |	Read Superman endured
EDL	00:06:23,487	00:06:26,303	| 99pi-0082-themanoftomorrow-1 |	They had this fantastic public R&D.
EDL	00:06:26,303	00:06:27,583	| 99pi-0082-themanoftomorrow-1 |	They just keep upping the ante
EDL	00:06:28,095	00:06:28,863	| 99pi-0082-themanoftomorrow-1 |	They kept making
EDL	00:06:28,863	00:06:29,631	| 99pi-0082-themanoftomorrow-1 |	Bigger
EDL	00:06:29,631	00:06:30,143	| 99pi-0082-themanoftomorrow-1 |	And more powerful
EDL	00:06:31,167	00:06:34,239	| 99pi-0082-themanoftomorrow-1 |	Started throwing in all these other
EDL	00:06:35,007	00:06:35,519	| 99pi-0082-themanoftomorrow-1 |	Door trying to
EDL	00:06:36,031	00:06:37,823	| 99pi-0082-themanoftomorrow-1 |	Mission trying throwing all these other powers
EDL	00:06:39,359	00:06:41,407	| 99pi-0082-themanoftomorrow-1 |	Song which really didn't
EDL	00:06:41,407	00:06:42,687	| 99pi-0082-themanoftomorrow-1 |	One of the first
EDL	00:06:42,687	00:06:43,711	| 99pi-0082-themanoftomorrow-1 |	Weird
EDL	00:06:43,711	00:06:44,735	| 99pi-0082-themanoftomorrow-1 |	Powers he had early on
EDL	00:06:45,247	00:06:47,807	| 99pi-0082-themanoftomorrow-1 |	Was the ability to contort the muscles
EDL	00:06:47,807	00:06:48,575	| 99pi-0082-themanoftomorrow-1 |	Look as face
EDL	00:06:48,575	00:06:52,415	| 99pi-0082-themanoftomorrow-1 |	To change his appearance and pass himself off as somebody else
EDL	00:06:53,183	00:06:54,719	| 99pi-0082-themanoftomorrow-1 |	Now that doesn't Square
EDL	00:06:54,719	00:06:55,487	| 99pi-0082-themanoftomorrow-1 |	With the iconography
EDL	00:06:56,511	00:06:57,279	| 99pi-0082-themanoftomorrow-1 |	Hi who's really
EDL	00:06:57,279	00:06:58,559	| 99pi-0082-themanoftomorrow-1 |	Better than you can just
EDL	00:06:58,559	00:06:59,583	| 99pi-0082-themanoftomorrow-1 |	What we can do
EDL	00:06:59,583	00:07:00,351	| 99pi-0082-themanoftomorrow-1 |	Only more
EDL	00:07:00,863	00:07:01,887	| 99pi-0082-themanoftomorrow-1 |	It went away
EDL	00:07:01,887	00:07:04,447	| 99pi-0082-themanoftomorrow-1 |	Because it's not the power of a superhero That's The Power of a
EDL	00:07:06,495	00:07:07,519	| 99pi-0082-themanoftomorrow-1 |	Adopting somebody else
EDL	00:07:07,519	00:07:08,287	| 99pi-0082-themanoftomorrow-1 |	Disguise
EDL	00:07:08,287	00:07:08,799	| 99pi-0082-themanoftomorrow-1 |	Can go undercover
EDL	00:07:09,311	00:07:10,591	| 99pi-0082-themanoftomorrow-1 |	It's not that doesn't square with
EDL	00:07:11,103	00:07:14,943	| 99pi-0082-themanoftomorrow-1 |	And when you have powerful enough iconography you can make mistakes like that
EDL	00:07:15,455	00:07:17,247	| 99pi-0082-themanoftomorrow-1 |	And it doesn't have a lasting effect
EDL	00:07:17,247	00:07:18,271	| 99pi-0082-themanoftomorrow-1 |	The other powers
EDL	00:07:18,783	00:07:20,319	| 99pi-0082-themanoftomorrow-1 |	Are things like
EDL	00:07:20,319	00:07:21,087	| 99pi-0082-themanoftomorrow-1 |	Super hearing
EDL	00:07:22,111	00:07:22,879	| 99pi-0082-themanoftomorrow-1 |	Super
EDL	00:07:22,879	00:07:23,903	| 99pi-0082-themanoftomorrow-1 |	Vision diesel
EDL	00:07:23,903	00:07:25,951	| 99pi-0082-themanoftomorrow-1 |	And telescopic Vision x-ray vision these things
EDL	00:07:25,951	00:07:26,719	| 99pi-0082-themanoftomorrow-1 |	Are about
EDL	00:07:27,487	00:07:28,511	| 99pi-0082-themanoftomorrow-1 |	Traits that we possess
EDL	00:07:28,511	00:07:29,279	| 99pi-0082-themanoftomorrow-1 |	That just
EDL	00:07:29,279	00:07:30,047	| 99pi-0082-themanoftomorrow-1 |	Skip boost
EDL	00:07:30,047	00:07:30,815	| 99pi-0082-themanoftomorrow-1 |	That's what the
EDL	00:07:30,815	00:07:31,327	| 99pi-0082-themanoftomorrow-1 |	Is characters about
EDL	00:07:32,351	00:07:35,423	| 99pi-0082-themanoftomorrow-1 |	Later on the course we get things like super hypnotism
EDL	00:07:35,423	00:07:36,703	| 99pi-0082-themanoftomorrow-1 |	Man super ventriloquism
EDL	00:07:37,215	00:07:39,007	| 99pi-0082-themanoftomorrow-1 |	Products of an age
EDL	00:07:39,007	00:07:41,055	| 99pi-0082-themanoftomorrow-1 |	Of comics, Superman
EDL	00:07:41,567	00:07:42,591	| 99pi-0082-themanoftomorrow-1 |	When things got really
EDL	00:07:43,103	00:07:46,175	| 99pi-0082-themanoftomorrow-1 |	Happens to be my favorite era of this character
EDL	00:07:46,175	00:07:47,967	| 99pi-0082-themanoftomorrow-1 |	Because things just get bananas
EDL	00:07:47,967	00:07:48,479	| 99pi-0082-themanoftomorrow-1 |	And
EDL	00:07:48,991	00:07:50,783	| 99pi-0082-themanoftomorrow-1 |	Superman has become so powerful
EDL	00:07:51,807	00:07:53,599	| 99pi-0082-themanoftomorrow-1 |	That the focus starts to shift away from
EDL	00:07:53,599	00:07:54,623	| 99pi-0082-themanoftomorrow-1 |	12 Lois Lane
EDL	00:07:55,903	00:07:56,671	| 99pi-0082-themanoftomorrow-1 |	The people around him
EDL	00:07:57,183	00:07:57,951	| 99pi-0082-themanoftomorrow-1 |	Superdawg
EDL	00:07:57,951	00:07:59,487	| 99pi-0082-themanoftomorrow-1 |	Super Monkey the super cat
EDL	00:07:59,487	00:08:01,279	| 99pi-0082-themanoftomorrow-1 |	Super horse all these other things around
EDL	00:08:01,279	00:08:02,047	| 99pi-0082-themanoftomorrow-1 |	Can you become to the
EDL	00:08:02,047	00:08:03,327	| 99pi-0082-themanoftomorrow-1 |	Patriarch of this
EDL	00:08:03,327	00:08:04,095	| 99pi-0082-themanoftomorrow-1 |	Extended family
EDL	00:08:04,607	00:08:05,631	| 99pi-0082-themanoftomorrow-1 |	Of people in blue long john
EDL	00:08:06,143	00:08:12,031	| 99pi-0082-themanoftomorrow-1 |	But beyond the comic book superfan none of that stuff filter too far out into popular culture and stuck around
EDL	00:08:12,031	00:08:14,591	| 99pi-0082-themanoftomorrow-1 |	The one power that they develop later
EDL	00:08:14,591	00:08:17,919	| 99pi-0082-themanoftomorrow-1 |	I got folded into the very core of the character
EDL	00:08:17,919	00:08:18,943	| 99pi-0082-themanoftomorrow-1 |	Was flight
EDL	00:08:18,943	00:08:20,223	| 99pi-0082-themanoftomorrow-1 |	Original you could just jump around
EDL	00:08:20,223	00:08:23,295	| 99pi-0082-themanoftomorrow-1 |	Turn on the page that's fine you see him in mid-air
EDL	00:08:23,295	00:08:25,343	| 99pi-0082-themanoftomorrow-1 |	But as soon as the Fleischer animated shorts
EDL	00:08:26,367	00:08:27,647	| 99pi-0082-themanoftomorrow-1 |	The very first couple
EDL	00:08:27,647	00:08:28,159	| 99pi-0082-themanoftomorrow-1 |	He jumps around
EDL	00:08:28,927	00:08:29,695	| 99pi-0082-themanoftomorrow-1 |	And it looks
EDL	00:08:31,743	00:08:33,023	| 99pi-0082-themanoftomorrow-1 |	It just doesn't work
EDL	00:08:33,535	00:08:34,559	| 99pi-0082-themanoftomorrow-1 |	So very soon
EDL	00:08:35,071	00:08:38,655	| 99pi-0082-themanoftomorrow-1 |	In on the radio show you know the sound of him jumping around
EDL	00:08:38,655	00:08:40,191	| 99pi-0082-themanoftomorrow-1 |	Suspended sound of
EDL	00:08:40,191	00:08:40,959	| 99pi-0082-themanoftomorrow-1 |	Wind noise
EDL	00:08:40,959	00:08:41,983	| 99pi-0082-themanoftomorrow-1 |	It was clear
EDL	00:08:42,495	00:08:43,519	| 99pi-0082-themanoftomorrow-1 |	Flying through the air
EDL	00:08:43,519	00:08:44,031	| 99pi-0082-themanoftomorrow-1 |	Defying Gravity
EDL	00:08:44,543	00:08:46,591	| 99pi-0082-themanoftomorrow-1 |	And that's what happened in the Flasher
EDL	00:08:46,591	00:08:48,383	| 99pi-0082-themanoftomorrow-1 |	Bridge of the comics a long time
EDL	00:08:48,895	00:08:49,919	| 99pi-0082-themanoftomorrow-1 |	To agree that y'all cake
EDL	00:08:50,687	00:08:51,455	| 99pi-0082-themanoftomorrow-1 |	Because
EDL	00:08:51,967	00:08:54,015	| 99pi-0082-themanoftomorrow-1 |	Beat the thing you could do was be better than us
EDL	00:08:54,527	00:08:57,855	| 99pi-0082-themanoftomorrow-1 |	But this idea of somebody being able to hover in mid-air
EDL	00:08:57,855	00:08:59,391	| 99pi-0082-themanoftomorrow-1 |	Was just too much of a break
EDL	00:09:00,415	00:09:01,439	| 99pi-0082-themanoftomorrow-1 |	From from the kind of
EDL	00:09:01,439	00:09:02,207	| 99pi-0082-themanoftomorrow-1 |	Grounded
EDL	00:09:02,207	00:09:03,487	| 99pi-0082-themanoftomorrow-1 |	Grounded stories
EDL	00:09:03,487	00:09:04,511	| 99pi-0082-themanoftomorrow-1 |	Matt Siegel intrusive
EDL	00:09:04,511	00:09:05,279	| 99pi-0082-themanoftomorrow-1 |	Retallack
EDL	00:09:05,279	00:09:06,559	| 99pi-0082-themanoftomorrow-1 |	But once he did
EDL	00:09:06,559	00:09:09,119	| 99pi-0082-themanoftomorrow-1 |	Once he did become a
EDL	00:09:09,119	00:09:09,887	| 99pi-0082-themanoftomorrow-1 |	A capable of
EDL	00:09:09,887	00:09:10,911	| 99pi-0082-themanoftomorrow-1 |	Flying Defying Gravity
EDL	00:09:15,007	00:09:16,543	| 99pi-0082-themanoftomorrow-1 |	You will believe a man can fly
EDL	00:09:17,055	00:09:18,591	| 99pi-0082-themanoftomorrow-1 |	Because there's something Primal about
EDL	00:09:18,591	00:09:19,359	| 99pi-0082-themanoftomorrow-1 |	That there's something that
EDL	00:09:19,359	00:09:22,175	| 99pi-0082-themanoftomorrow-1 |	Man is always wanted to do and so we got this guy
EDL	00:09:22,687	00:09:23,455	| 99pi-0082-themanoftomorrow-1 |	Can bring it along.
EDL	00:09:23,967	00:09:24,735	| 99pi-0082-themanoftomorrow-1 |	Unemployment
EDL	00:09:24,735	00:09:26,527	| 99pi-0082-themanoftomorrow-1 |	You can do it and that's what we looked
EDL	00:09:27,295	00:09:27,807	| 99pi-0082-themanoftomorrow-1 |	Recognize
EDL	00:09:28,831	00:09:29,855	| 99pi-0082-themanoftomorrow-1 |	Now today but it wasn't always the case
EDL	00:09:36,255	00:09:39,071	| 99pi-0082-themanoftomorrow-1 |	As you go to the history of Superman England weldon's book
EDL	00:09:39,071	00:09:42,655	| 99pi-0082-themanoftomorrow-1 |	You find a character that adapts in strange ways to reflect
EDL	00:09:43,167	00:09:45,471	| 99pi-0082-themanoftomorrow-1 |	The Zeitgeist and anxieties of the time
EDL	00:09:45,983	00:09:48,799	| 99pi-0082-themanoftomorrow-1 |	But certain qualities get written into Superman zna
EDL	00:09:48,799	00:09:51,615	| 99pi-0082-themanoftomorrow-1 |	The phone the real basis of what makes Superman
EDL	00:09:52,127	00:09:52,639	| 99pi-0082-themanoftomorrow-1 |	Superman
EDL	00:09:53,151	00:09:55,455	| 99pi-0082-themanoftomorrow-1 |	And it has nothing to do with the way he looks
EDL	00:09:55,455	00:09:57,503	| 99pi-0082-themanoftomorrow-1 |	Ultimately what I found over the course of the
EDL	00:09:58,015	00:10:00,831	| 99pi-0082-themanoftomorrow-1 |	Writing a book is that a lot of the stuff comes and goes
EDL	00:10:00,831	00:10:03,647	| 99pi-0082-themanoftomorrow-1 |	What's the red shorts can come and go espectro goes away it's comes back
EDL	00:10:04,159	00:10:06,207	| 99pi-0082-themanoftomorrow-1 |	Gets a different costume you gets this
EDL	00:10:06,207	00:10:07,231	| 99pi-0082-themanoftomorrow-1 |	Weird electrical blue
EDL	00:10:07,743	00:10:09,023	| 99pi-0082-themanoftomorrow-1 |	Costume in the 90s everything psycho
EDL	00:10:10,303	00:10:11,071	| 99pi-0082-themanoftomorrow-1 |	But
EDL	00:10:11,071	00:10:12,095	| 99pi-0082-themanoftomorrow-1 |	It's not what he looks
EDL	00:10:12,095	00:10:13,887	| 99pi-0082-themanoftomorrow-1 |	Even though that is considered the iconography
EDL	00:10:14,399	00:10:15,167	| 99pi-0082-themanoftomorrow-1 |	He looks like
EDL	00:10:16,191	00:10:17,215	| 99pi-0082-themanoftomorrow-1 |	It is what he does
EDL	00:10:18,751	00:10:20,543	| 99pi-0082-themanoftomorrow-1 |	Number one he puts the needs of others
EDL	00:10:20,543	00:10:21,311	| 99pi-0082-themanoftomorrow-1 |	Overdose
EDL	00:10:22,079	00:10:22,847	| 99pi-0082-themanoftomorrow-1 |	And be he does
EDL	00:10:23,615	00:10:24,895	| 99pi-0082-themanoftomorrow-1 |	So those two Elam
EDL	00:10:24,895	00:10:26,687	| 99pi-0082-themanoftomorrow-1 |	Either one of those two elements are missing
