EDL	Record In	Record Out	Clipname	Subtitle
EDL	00:43:33,247	00:43:37,599	| IOT064 |	Will essentially becomes a new branch of tomorrow so I think the the reality of the approaching the
EDL	00:43:38,111	00:43:40,415	| IOT064 |	Continues its are going to happen over the next 10 years
EDL	00:43:41,183	00:43:43,487	| IOT064 |	Cleansing markets go up go down
EDL	00:43:43,487	00:43:47,327	| IOT064 |	But if you end of the day great companies are created in Old Cycles
EDL	00:43:47,327	00:43:49,887	| IOT064 |	So what I've been crate show everyone to
EDL	00:43:49,887	00:43:52,703	| IOT064 |	Just to keep the face
EDL	00:43:53,215	00:43:55,007	| IOT064 |	Thanks for having me Stacy and really enjoyed it
EDL	00:43:55,007	00:44:01,407	| IOT064 |	Thank you that's it for this week's show please join us next week on the Internet of Things podcast
EDL	00:44:01,407	00:44:07,551	| IOT064 |	And thanks for listening 
