EDL	Record In	Record Out	Clipname	Subtitle
EDL	00:00:01,024	00:00:03,840	| 27-Bridge-to-the-Sky |	99percentinvisible is brought to you by Progressive
EDL	00:00:03,840	00:00:06,656	| 27-Bridge-to-the-Sky |	One of the country's leading providers of auto insurance
EDL	00:00:06,656	00:00:08,960	| 27-Bridge-to-the-Sky |	With progressives Name Your Price tool
EDL	00:00:08,960	00:00:15,104	| 27-Bridge-to-the-Sky |	You can say what kind of coverage were looking for and how much you want to pay and Progressive will show you options that fit within your budget
EDL	00:00:15,616	00:00:18,944	| 27-Bridge-to-the-Sky |	Use the Name Your Price tool and start an online quote today
EDL	00:00:18,944	00:00:19,968	| 27-Bridge-to-the-Sky |	Progressive.com
EDL	00:00:20,480	00:00:22,784	| 27-Bridge-to-the-Sky |	Price in coverage match limited by state law
EDL	00:00:24,576	00:00:30,976	| 27-Bridge-to-the-Sky |	Family ghosts is a podcast explores all the unexpected ways our family structure and shape our view
EDL	00:00:30,976	00:00:31,744	| 27-Bridge-to-the-Sky |	Of the world
EDL	00:00:31,744	00:00:38,144	| 27-Bridge-to-the-Sky |	Each episode of Family ghosts takes a look at the story behind a different person's family lore digging into
EDL	00:00:38,144	00:00:40,192	| 27-Bridge-to-the-Sky |	Unanswered questions about their history
EDL	00:00:40,192	00:00:46,592	| 27-Bridge-to-the-Sky |	Season 2 Launches on May 15th featuring an episode where they take you inside the love Israel family called
EDL	00:00:46,592	00:00:50,688	| 27-Bridge-to-the-Sky |	So what about uncovering the secret scroll in a newly discovered stack of Love Letters
EDL	00:00:50,688	00:00:57,088	| 27-Bridge-to-the-Sky |	Asuna episode that brings you along to the hunt for a container of missing Chinese food that's haunted a family
EDL	00:00:57,088	00:00:58,880	| 27-Bridge-to-the-Sky |	For 25 years and more
EDL	00:00:59,392	00:01:03,488	| 27-Bridge-to-the-Sky |	Subscribe to family goes wherever you get your podcast and find out why they say
EDL	00:01:03,488	00:01:04,768	| 27-Bridge-to-the-Sky |	Every house is haunted
EDL	00:01:06,304	00:01:12,704	| 27-Bridge-to-the-Sky |	We get support from UC Davis globally ranked University working to solve the world's most pressing problems and food
EDL	00:01:12,704	00:01:15,264	| 27-Bridge-to-the-Sky |	Energy health education and the environment
EDL	00:01:15,264	00:01:21,408	| 27-Bridge-to-the-Sky |	UC Davis researchers collaborate and innovate in California and around the globe Define transformational Solutions
EDL	00:01:21,408	00:01:25,504	| 27-Bridge-to-the-Sky |	Quality of life for all living things
EDL	00:01:25,504	00:01:29,600	| 27-Bridge-to-the-Sky |	Find out more at 21st century. Ucdavis.edu
EDL	00:01:33,952	00:01:35,744	| 27-Bridge-to-the-Sky |	This is 99% invisible
EDL	00:01:36,256	00:01:37,024	| 27-Bridge-to-the-Sky |	I'm Roman Mars
EDL	00:01:38,048	00:01:39,584	| 27-Bridge-to-the-Sky |	From the point of view of physics
EDL	00:01:39,584	00:01:40,864	| 27-Bridge-to-the-Sky |	It would seem a little less
EDL	00:01:41,376	00:01:47,776	| 27-Bridge-to-the-Sky |	Funny new ways to create new buildings with new technology has been the bread-and-butter of the Leading Edge architects
EDL	00:01:47,776	00:01:49,312	| 27-Bridge-to-the-Sky |	Since there have been
EDL	00:01:49,312	00:01:51,104	| 27-Bridge-to-the-Sky |	Leading Edge architects
EDL	00:01:51,104	00:01:53,920	| 27-Bridge-to-the-Sky |	Today my friend Nate dimeo hey Nate
EDL	00:01:53,920	00:01:55,712	| 27-Bridge-to-the-Sky |	Has the story of one of those men
EDL	00:01:56,224	00:01:56,992	| 27-Bridge-to-the-Sky |	A man who
EDL	00:01:56,992	00:01:59,040	| 27-Bridge-to-the-Sky |	Time on the Leading Edge was brief
EDL	00:01:59,040	00:02:00,064	| 27-Bridge-to-the-Sky |	But dramatic
EDL	00:02:00,064	00:02:06,208	| 27-Bridge-to-the-Sky |	Made it the creator of the Memory Palace the History Podcast that is all about being brief and dramatic
EDL	00:02:06,208	00:02:12,352	| 27-Bridge-to-the-Sky |	This is the story of visionary Daredevil architect Bradford Gilbert
EDL	00:02:13,632	00:02:15,936	| 27-Bridge-to-the-Sky |	Bradford Gilbert at Spanish Square close to the ground
EDL	00:02:17,472	00:02:21,568	| 27-Bridge-to-the-Sky |	23 he took a job is the architect for the New York Lake Erie and Western Railroad
EDL	00:02:22,080	00:02:23,104	| 27-Bridge-to-the-Sky |	Who's 1878
EDL	00:02:24,384	00:02:27,456	| 27-Bridge-to-the-Sky |	As an older man Central Station
EDL	00:02:28,480	00:02:32,576	| 27-Bridge-to-the-Sky |	Central location
EDL	00:02:32,576	00:02:35,648	| 27-Bridge-to-the-Sky |	The places you waited to get places where things actually happened
EDL	00:02:36,672	00:02:39,232	| 27-Bridge-to-the-Sky |	But buy ticket for Manhattan or St Louis Arch
EDL	00:02:40,256	00:02:42,816	| 27-Bridge-to-the-Sky |	Can you can find other Architects building more impressed
EDL	00:02:42,816	00:02:43,584	| 27-Bridge-to-the-Sky |	Thanks
EDL	00:02:43,584	00:02:45,376	| 27-Bridge-to-the-Sky |	6 + 8 + 10 story structure
EDL	00:02:46,144	00:02:49,216	| 27-Bridge-to-the-Sky |	Mammoth blocks of stone and brick and wrought iron
EDL	00:02:49,216	00:02:51,776	| 27-Bridge-to-the-Sky |	Made for the kings of the modern American Insurance in
EDL	00:02:52,800	00:02:54,336	| 27-Bridge-to-the-Sky |	The emperor is of import
EDL	00:02:54,336	00:02:54,848	| 27-Bridge-to-the-Sky |	What's an export
EDL	00:02:56,384	00:02:58,688	| 27-Bridge-to-the-Sky |	John Noble Stearns made a lot of money importing
EDL	00:02:58,688	00:03:01,248	| 27-Bridge-to-the-Sky |	Silk anyways looking to make a lot more in real estate
EDL	00:03:01,760	00:03:03,808	| 27-Bridge-to-the-Sky |	He bought some land in a prime location
EDL	00:03:03,808	00:03:04,576	| 27-Bridge-to-the-Sky |	850 Broadway
EDL	00:03:05,344	00:03:06,112	| 27-Bridge-to-the-Sky |	But there was a problem
EDL	00:03:07,136	00:03:09,440	| 27-Bridge-to-the-Sky |	Dwight was only 21 and 1/2 feet wide
EDL	00:03:10,208	00:03:12,256	| 27-Bridge-to-the-Sky |	There are rules that dictate what you can build and how
EDL	00:03:12,768	00:03:17,120	| 27-Bridge-to-the-Sky |	Rules of physics and rules of men who sit on various bureaucratic boards and body
EDL	00:03:17,632	00:03:23,520	| 27-Bridge-to-the-Sky |	And those rules dictated that if Stearns wanted to build one of those 10-story towers that were all the rage in 1888
EDL	00:03:24,032	00:03:26,080	| 27-Bridge-to-the-Sky |	You need to build walls of stone and brick
EDL	00:03:26,592	00:03:27,872	| 27-Bridge-to-the-Sky |	That were five feet thick
EDL	00:03:27,872	00:03:31,456	| 27-Bridge-to-the-Sky |	That was no for an interior that was only 11 ft wide
EDL	00:03:31,968	00:03:35,552	| 27-Bridge-to-the-Sky |	Play stuff you need for a hallway a few for a bathroom
EDL	00:03:35,552	00:03:39,648	| 27-Bridge-to-the-Sky |	Couple fur coat closet another for some filing cabinets in an umbrella stand
EDL	00:03:40,672	00:03:44,000	| 27-Bridge-to-the-Sky |	He asked me the quintessential modern Titan of American industry
EDL	00:03:44,512	00:03:47,840	| 27-Bridge-to-the-Sky |	Torque in a dark cell better suited for a dark ages Monk
EDL	00:03:48,864	00:03:50,400	| 27-Bridge-to-the-Sky |	During diastole the best dark
EDL	00:03:50,400	00:03:50,912	| 27-Bridge-to-the-Sky |	Extra solution
EDL	00:03:51,424	00:03:52,704	| 27-Bridge-to-the-Sky |	They all told him it couldn't be done
EDL	00:03:54,240	00:03:56,032	| 27-Bridge-to-the-Sky |	Everyone except Bradford Gilbert
EDL	00:03:57,056	00:04:00,384	| 27-Bridge-to-the-Sky |	The in-house architects of the New York Lake Erie and Western railroad had a theory
EDL	00:04:01,408	00:04:05,504	| 27-Bridge-to-the-Sky |	Hundreds of tons of cars in cargo we're hurtling over
EDL	00:04:05,504	00:04:06,016	| 27-Bridge-to-the-Sky |	Everyday
EDL	00:04:07,296	00:04:09,344	| 27-Bridge-to-the-Sky |	What if you turn one of those bridges on its head
EDL	00:04:09,856	00:04:11,136	| 27-Bridge-to-the-Sky |	What if he built a bridge up
EDL	00:04:11,904	00:04:12,416	| 27-Bridge-to-the-Sky |	Instead of out
EDL	00:04:13,184	00:04:14,976	| 27-Bridge-to-the-Sky |	Hold strength if he did this
EDL	00:04:14,976	00:04:16,768	| 27-Bridge-to-the-Sky |	The walls wouldn't have to be fine people
EDL	00:04:17,536	00:04:19,071	| 27-Bridge-to-the-Sky |	They could be just dine in
EDL	00:04:19,583	00:04:21,119	| 27-Bridge-to-the-Sky |	20 foot wide office
EDL	00:04:21,119	00:04:22,143	| 27-Bridge-to-the-Sky |	Places that would create
EDL	00:04:22,655	00:04:24,959	| 27-Bridge-to-the-Sky |	Quintessential modern American Titan
EDL	00:04:25,471	00:04:26,751	| 27-Bridge-to-the-Sky |	Reverend stretch out of blacks
EDL	00:04:27,263	00:04:29,823	| 27-Bridge-to-the-Sky |	Volume 8 is rent check out to John Noble Stearns
EDL	00:04:30,591	00:04:31,359	| 27-Bridge-to-the-Sky |	Architect
EDL	00:04:31,359	00:04:32,895	| 27-Bridge-to-the-Sky |	Came in from all over the country
EDL	00:04:32,895	00:04:34,687	| 27-Bridge-to-the-Sky |	To watch the tower building rise
EDL	00:04:35,199	00:04:36,735	| 27-Bridge-to-the-Sky |	Deport over Gilbert's blueprints
EDL	00:04:39,295	00:04:40,575	| 27-Bridge-to-the-Sky |	Gilbert and Stern
EDL	00:04:41,855	00:04:43,647	| 27-Bridge-to-the-Sky |	Beg Gilbert to change the plan
EDL	00:04:44,415	00:04:45,183	| 27-Bridge-to-the-Sky |	But he refused
EDL	00:04:45,951	00:04:47,999	| 27-Bridge-to-the-Sky |	He said he was so confident in his design
EDL	00:04:48,511	00:04:49,535	| 27-Bridge-to-the-Sky |	Good movies off
EDL	00:04:50,559	00:04:51,071	| 27-Bridge-to-the-Sky |	2 floors of the building
EDL	00:04:53,375	00:04:54,399	| 27-Bridge-to-the-Sky |	You would have the farthest
EDL	00:04:55,935	00:05:00,031	| 27-Bridge-to-the-Sky |	The first stiff Winds of a hurricane blew into Manhattan on a Sunday morning 1889
EDL	00:05:01,311	00:05:02,847	| 27-Bridge-to-the-Sky |	The tower building stood
EDL	00:05:02,847	00:05:03,615	| 27-Bridge-to-the-Sky |	Nearly complete
EDL	00:05:04,639	00:05:05,919	| 27-Bridge-to-the-Sky |	People lined the streets to watch it
EDL	00:05:07,455	00:05:08,735	| 27-Bridge-to-the-Sky |	Men pursue the crowd
EDL	00:05:09,247	00:05:10,015	| 27-Bridge-to-the-Sky |	And began to climb
EDL	00:05:11,039	00:05:13,087	| 27-Bridge-to-the-Sky |	When Bradford Gilbert reach the top of his Tower
EDL	00:05:13,855	00:05:17,183	| 27-Bridge-to-the-Sky |	The wind was whipping through its skeleton frame it more than 80 miles an hour
EDL	00:05:17,183	00:05:18,719	| 27-Bridge-to-the-Sky |	He called out to the center of the building
EDL	00:05:19,487	00:05:20,767	| 27-Bridge-to-the-Sky |	Pulled from a bag
EDL	00:05:20,767	00:05:21,279	| 27-Bridge-to-the-Sky |	A rope
EDL	00:05:21,791	00:05:23,583	| 27-Bridge-to-the-Sky |	With the lead weight attached to one end
EDL	00:05:24,607	00:05:26,143	| 27-Bridge-to-the-Sky |	You tied the other two a girder
EDL	00:05:26,143	00:05:28,703	| 27-Bridge-to-the-Sky |	You toss the way down through the open floors below
EDL	00:05:29,727	00:05:31,263	| 27-Bridge-to-the-Sky |	When you called his way back down
EDL	00:05:31,775	00:05:32,799	| 27-Bridge-to-the-Sky |	He found the lead weight
EDL	00:05:32,799	00:05:33,311	| 27-Bridge-to-the-Sky |	Hang in there
EDL	00:05:34,079	00:05:34,591	| 27-Bridge-to-the-Sky |	Stocksdale
EDL	00:05:35,359	00:05:37,407	| 27-Bridge-to-the-Sky |	Held up by a building that wasn't going anywhere
EDL	00:05:38,687	00:05:39,455	| 27-Bridge-to-the-Sky |	4 years after
EDL	00:05:40,223	00:05:43,295	| 27-Bridge-to-the-Sky |	Gilbert could Fitness Penthouse office in the still-standing tower
EDL	00:05:44,319	00:05:45,087	| 27-Bridge-to-the-Sky |	And stretch out of
EDL	00:05:46,367	00:05:47,391	| 27-Bridge-to-the-Sky |	Watch a whole city
EDL	00:05:47,903	00:05:48,671	| 27-Bridge-to-the-Sky |	Stretch ever higher
EDL	00:05:49,951	00:05:50,975	| 27-Bridge-to-the-Sky |	Taking his idea
EDL	00:05:50,975	00:05:51,743	| 27-Bridge-to-the-Sky |	In building on it
EDL	00:05:53,535	00:05:58,399	| 27-Bridge-to-the-Sky |	99% invisible is produced this week by Nate dimeo I'm your host Roman Mars
EDL	00:05:58,399	00:06:03,007	| 27-Bridge-to-the-Sky |	This program is made possible with support from lunar making a difference with creativity
EDL	00:06:03,007	00:06:06,591	| 27-Bridge-to-the-Sky |	It's a project of kalw the American Institute of Architects San
EDL	00:06:07,103	00:06:09,151	| 27-Bridge-to-the-Sky |	Center for architecture and Design
EDL	00:06:09,151	00:06:13,247	| 27-Bridge-to-the-Sky |	To find out more and get a link to Nate Tomatoes brilliant Memory Palace podcast
EDL	00:06:13,759	00:06:15,295	| 27-Bridge-to-the-Sky |	Go to 99% invisible
EDL	00:06:15,807	00:06:16,319	| 27-Bridge-to-the-Sky |	. org
EDL	00:06:18,879	00:06:25,279	| 27-Bridge-to-the-Sky |	Before we go I want to tell you about the body genius a five-part series from fellow radiotopia show the truth
EDL	00:06:25,279	00:06:29,375	| 27-Bridge-to-the-Sky |	The body genius is a Dark comic mystery that whines through a
EDL	00:06:29,375	00:06:31,423	| 27-Bridge-to-the-Sky |	Treacherous fictionalized Hollywood
EDL	00:06:31,423	00:06:34,495	| 27-Bridge-to-the-Sky |	We're looking the part might cost you your life
EDL	00:06:34,495	00:06:39,615	| 27-Bridge-to-the-Sky |	You know how sometimes a famous actor has to get really jacked play superhero in a movie
EDL	00:06:39,615	00:06:43,967	| 27-Bridge-to-the-Sky |	Or lose a ton of weight to play a prisoner or a psychopath
EDL	00:06:43,967	00:06:48,063	| 27-Bridge-to-the-Sky |	Or put on 50lb all of a sudden to play like a dad
EDL	00:06:49,855	00:06:54,975	| 27-Bridge-to-the-Sky |	I'm a Hollywood trainer and I specialize in that stuff actually if I'm being honest
EDL	00:06:54,975	00:06:58,303	| 27-Bridge-to-the-Sky |	I'm one of the main guy to know how to do that kind of thing
EDL	00:06:58,303	00:07:04,703	| 27-Bridge-to-the-Sky |	A few days ago Wesley Stern and actor that I was helping to get huge for an action movie called Immortal cop
EDL	00:07:04,703	00:07:08,031	| 27-Bridge-to-the-Sky |	Was found dead in my private gym
EDL	00:07:08,031	00:07:14,431	| 27-Bridge-to-the-Sky |	Crushed inside a high-tech weight machine even worse the cops think that I had so
EDL	00:07:14,431	00:07:15,711	| 27-Bridge-to-the-Sky |	Something to do with it
EDL	00:07:15,711	00:07:16,735	| 27-Bridge-to-the-Sky |	Now
EDL	00:07:16,735	00:07:19,039	| 27-Bridge-to-the-Sky |	I need to clear my name
EDL	00:07:19,039	00:07:25,183	| 27-Bridge-to-the-Sky |	Somebody out there killed Wesley and I'm going to do whatever it takes to find them
EDL	00:07:25,695	00:07:32,095	| 27-Bridge-to-the-Sky |	Final episode of the body genius drops on May 30th bendall five-part
EDL	00:07:32,095	00:07:34,143	| 27-Bridge-to-the-Sky |	Arts on the truth podcast. Com 
