EDL	Record In	Record Out	Clipname	Subtitle
EDL	00:00:01,024	00:00:03,840	| 99pi-0274-theageofthealgorithm-1 |	99percentinvisible is brought to you by Progressive
EDL	00:00:03,840	00:00:06,144	| 99pi-0274-theageofthealgorithm-1 |	One of the country's leading providers of auto insurance
EDL	00:00:06,656	00:00:08,960	| 99pi-0274-theageofthealgorithm-1 |	With progressives Name Your Price tool
EDL	00:00:08,960	00:00:15,104	| 99pi-0274-theageofthealgorithm-1 |	You can say what kind of coverage were looking for and how much you want to pay and Progressive will show you options that fit within your budget
EDL	00:00:15,616	00:00:18,944	| 99pi-0274-theageofthealgorithm-1 |	Use the Name Your Price tool and start an online quote today
EDL	00:00:18,944	00:00:19,968	| 99pi-0274-theageofthealgorithm-1 |	Progressive.com
EDL	00:00:20,480	00:00:22,784	| 99pi-0274-theageofthealgorithm-1 |	Price in coverage match limited by state law
EDL	00:00:24,832	00:00:25,600	| 99pi-0274-theageofthealgorithm-1 |	Family ghosts
EDL	00:00:25,600	00:00:31,232	| 99pi-0274-theageofthealgorithm-1 |	Is a podcast explores all the unexpected ways our family structure and shape our view of the world
EDL	00:00:31,744	00:00:33,280	| 99pi-0274-theageofthealgorithm-1 |	Each episode of Family ghost
EDL	00:00:33,280	00:00:37,376	| 99pi-0274-theageofthealgorithm-1 |	Takes a look at the story behind a different person's family lore
EDL	00:00:37,376	00:00:40,192	| 99pi-0274-theageofthealgorithm-1 |	Digging into unanswered questions about their history
EDL	00:00:40,192	00:00:42,752	| 99pi-0274-theageofthealgorithm-1 |	Season 2 Launches on May 15th
EDL	00:00:42,752	00:00:46,080	| 99pi-0274-theageofthealgorithm-1 |	Between episode where they take you inside the love Israel family called
EDL	00:00:46,080	00:00:50,688	| 99pi-0274-theageofthealgorithm-1 |	An episode about uncovering the secrets scrolled in a newly discovered stack of Love Letters
EDL	00:00:50,688	00:00:57,088	| 99pi-0274-theageofthealgorithm-1 |	Asuna episode that brings you along to the hunt for a container of missing Chinese food that's haunted a family
EDL	00:00:57,088	00:00:58,368	| 99pi-0274-theageofthealgorithm-1 |	For 25 years
EDL	00:00:58,368	00:00:58,880	| 99pi-0274-theageofthealgorithm-1 |	And more
EDL	00:00:59,392	00:01:03,488	| 99pi-0274-theageofthealgorithm-1 |	Subscribe to family goes wherever you get your podcast and find out why they say
EDL	00:01:03,488	00:01:04,768	| 99pi-0274-theageofthealgorithm-1 |	Every house is haunted
EDL	00:01:05,792	00:01:07,328	| 99pi-0274-theageofthealgorithm-1 |	This is 99% invisible
EDL	00:01:07,840	00:01:08,608	| 99pi-0274-theageofthealgorithm-1 |	I'm Roman Mars
EDL	00:01:10,400	00:01:16,800	| 99pi-0274-theageofthealgorithm-1 |	On April 9th 2017 United Airlines flight 3411 was about to fly from Chicago to Louisville
EDL	00:01:16,800	00:01:19,616	| 99pi-0274-theageofthealgorithm-1 |	Flight attendants discovered the plane was overbooked
EDL	00:01:20,128	00:01:24,992	| 99pi-0274-theageofthealgorithm-1 |	I tried to get volunteers to give up their seats with Promises of travel vouchers and hotel accommodations
EDL	00:01:25,504	00:01:27,552	| 99pi-0274-theageofthealgorithm-1 |	But not enough people were willing to get off
EDL	00:01:33,440	00:01:35,744	| 99pi-0274-theageofthealgorithm-1 |	United ended up calling some airport security officers
EDL	00:01:36,256	00:01:40,096	| 99pi-0274-theageofthealgorithm-1 |	Board the plane and forcibly removed a passenger name doctor David down
EDL	00:01:40,608	00:01:42,656	| 99pi-0274-theageofthealgorithm-1 |	The officers ripped out of a seat
EDL	00:01:42,656	00:01:49,056	| 99pi-0274-theageofthealgorithm-1 |	And carry them down the aisle the airplane nose bleeding while horrified onlookers shot video with their phones
EDL	00:01:49,056	00:01:52,128	| 99pi-0274-theageofthealgorithm-1 |	Busted his lip
EDL	00:01:55,200	00:01:58,016	| 99pi-0274-theageofthealgorithm-1 |	You probably remember this incident in the outrage a generator
EDL	00:01:58,528	00:02:04,928	| 99pi-0274-theageofthealgorithm-1 |	The international uproar continued over the forced removal of a passenger from the United Airlines flight
EDL	00:02:04,928	00:02:08,256	| 99pi-0274-theageofthealgorithm-1 |	Today the airline CEO Oscar Munoz
EDL	00:02:08,256	00:02:10,560	| 99pi-0274-theageofthealgorithm-1 |	Issued an apology saying quote
EDL	00:02:10,560	00:02:13,376	| 99pi-0274-theageofthealgorithm-1 |	No one should ever be mistreated this way
EDL	00:02:13,376	00:02:14,656	| 99pi-0274-theageofthealgorithm-1 |	I want you to know that
EDL	00:02:14,656	00:02:15,168	| 99pi-0274-theageofthealgorithm-1 |	We take forward
EDL	00:02:16,960	00:02:18,240	| 99pi-0274-theageofthealgorithm-1 |	But why doctor
EDL	00:02:19,264	00:02:23,360	| 99pi-0274-theageofthealgorithm-1 |	How did he end up being the Unlucky passenger that United decided to remove
EDL	00:02:23,872	00:02:25,664	| 99pi-0274-theageofthealgorithm-1 |	Immediately following the incident
EDL	00:02:25,664	00:02:28,480	| 99pi-0274-theageofthealgorithm-1 |	Some people thought racial discrimination may have played a part
EDL	00:02:28,480	00:02:30,784	| 99pi-0274-theageofthealgorithm-1 |	And it's possible that this played a role in how you
EDL	00:02:30,784	00:02:31,296	| 99pi-0274-theageofthealgorithm-1 |	Treated
EDL	00:02:31,808	00:02:33,856	| 99pi-0274-theageofthealgorithm-1 |	But the answer to how he was chosen
EDL	00:02:33,856	00:02:34,368	| 99pi-0274-theageofthealgorithm-1 |	Was actually
EDL	00:02:34,880	00:02:35,648	| 99pi-0274-theageofthealgorithm-1 |	An algorithm
EDL	00:02:36,160	00:02:36,928	| 99pi-0274-theageofthealgorithm-1 |	Computer program
EDL	00:02:37,696	00:02:38,976	| 99pi-0274-theageofthealgorithm-1 |	It runs through a bunch of data
EDL	00:02:39,488	00:02:45,120	| 99pi-0274-theageofthealgorithm-1 |	Looking at stuff like how much each passenger I pays their ticket what time they checked into off Nicky one United
EDL	00:02:45,120	00:02:47,424	| 99pi-0274-theageofthealgorithm-1 |	And whether they were part of a rewards program
EDL	00:02:47,936	00:02:53,056	| 99pi-0274-theageofthealgorithm-1 |	The algorithm likely determined that dr.dao was one of the least valuable customers on the Fly
EDL	00:02:53,056	00:02:53,568	| 99pi-0274-theageofthealgorithm-1 |	I got the time
EDL	00:02:57,152	00:03:01,504	| 99pi-0274-theageofthealgorithm-1 |	Algorithms shape our world and profound and mostly invisible ways
EDL	00:03:01,504	00:03:03,808	| 99pi-0274-theageofthealgorithm-1 |	They predict it will be valuable customers
EDL	00:03:03,808	00:03:06,112	| 99pi-0274-theageofthealgorithm-1 |	Or whether were likely to repay a loan
EDL	00:03:06,112	00:03:08,416	| 99pi-0274-theageofthealgorithm-1 |	They filter what we see on social media
EDL	00:03:08,416	00:03:09,440	| 99pi-0274-theageofthealgorithm-1 |	Sort to resume
EDL	00:03:09,440	00:03:10,464	| 99pi-0274-theageofthealgorithm-1 |	And evaluate job performance
EDL	00:03:10,976	00:03:13,280	| 99pi-0274-theageofthealgorithm-1 |	Inform prison sentences in Montour or hell
EDL	00:03:14,048	00:03:16,608	| 99pi-0274-theageofthealgorithm-1 |	Most of these algorithms have been created with good intentions
EDL	00:03:17,120	00:03:20,704	| 99pi-0274-theageofthealgorithm-1 |	The goal is to replace objective judgments with objective measurements
EDL	00:03:21,216	00:03:22,752	| 99pi-0274-theageofthealgorithm-1 |	But it doesn't always work out like that
EDL	00:03:23,520	00:03:24,032	| 99pi-0274-theageofthealgorithm-1 |	The subject
EDL	00:03:24,544	00:03:26,848	| 99pi-0274-theageofthealgorithm-1 |	Huge I think algorithm design Maybe
EDL	00:03:26,848	00:03:29,664	| 99pi-0274-theageofthealgorithm-1 |	The big design problem of the 21st Century
EDL	00:03:29,664	00:03:31,968	| 99pi-0274-theageofthealgorithm-1 |	And that's why I wanted to interview Cathy O'Neil
EDL	00:03:32,736	00:03:38,112	| 99pi-0274-theageofthealgorithm-1 |	Okay thank you so much so cuz when we start can you give me one of them sort of npr-style
EDL	00:03:38,112	00:03:40,928	| 99pi-0274-theageofthealgorithm-1 |	Introductions in to say your name and what you do
EDL	00:03:40,928	00:03:41,440	| 99pi-0274-theageofthealgorithm-1 |	Sure
EDL	00:03:41,952	00:03:45,024	| 99pi-0274-theageofthealgorithm-1 |	I'm Cathy O'Neil I'm a mathematician data scientist
EDL	00:03:45,024	00:03:51,424	| 99pi-0274-theageofthealgorithm-1 |	Activist an author I wrote the book weapons of math destruction how big did it increases in equality and threatens to
EDL	00:03:51,424	00:03:56,288	| 99pi-0274-theageofthealgorithm-1 |	Call Krissy O'Neal studied number Theory and then left Academia to build predictive algorithms for a hedgehog
EDL	00:03:57,056	00:04:01,664	| 99pi-0274-theageofthealgorithm-1 |	But she got really disillusioned by the use of mathematical models in the financial industry
EDL	00:04:01,664	00:04:04,224	| 99pi-0274-theageofthealgorithm-1 |	I wanted to like have more impact in the world
EDL	00:04:04,224	00:04:08,064	| 99pi-0274-theageofthealgorithm-1 |	But I didn't really know that that impact could be really terrible I was very naive
EDL	00:04:08,576	00:04:11,136	| 99pi-0274-theageofthealgorithm-1 |	Every. O'Neill work as a data scientist.
EDL	00:04:11,136	00:04:11,648	| 99pi-0274-theageofthealgorithm-1 |	Couple of startups
EDL	00:04:12,160	00:04:13,440	| 99pi-0274-theageofthealgorithm-1 |	And through these experiences
EDL	00:04:13,952	00:04:16,256	| 99pi-0274-theageofthealgorithm-1 |	She started to get worried about the influence of
EDL	00:04:16,256	00:04:17,536	| 99pi-0274-theageofthealgorithm-1 |	Poorly designed algorithm
EDL	00:04:18,303	00:04:20,351	| 99pi-0274-theageofthealgorithm-1 |	So we'll start with the most obvious question
EDL	00:04:20,351	00:04:21,119	| 99pi-0274-theageofthealgorithm-1 |	What is an algorithm
EDL	00:04:22,399	00:04:23,423	| 99pi-0274-theageofthealgorithm-1 |	As most basic
EDL	00:04:23,423	00:04:26,495	| 99pi-0274-theageofthealgorithm-1 |	An algorithm is a step-by-step guide to solving a problem
EDL	00:04:27,007	00:04:28,543	| 99pi-0274-theageofthealgorithm-1 |	It's a set of instructions like a recipe
EDL	00:04:29,055	00:04:32,127	| 99pi-0274-theageofthealgorithm-1 |	Cooking dinner for my family
EDL	00:04:32,895	00:04:36,223	| 99pi-0274-theageofthealgorithm-1 |	Do in this case the problem is how to make a successful dinner
EDL	00:04:36,735	00:04:38,783	| 99pi-0274-theageofthealgorithm-1 |	O'Neill starts with a set of ingredients
EDL	00:04:38,783	00:04:40,575	| 99pi-0274-theageofthealgorithm-1 |	She's creating the meal
EDL	00:04:40,575	00:04:46,207	| 99pi-0274-theageofthealgorithm-1 |	You constantly making choices about what ingredients are healthy enough to include in her dinner algorithm
EDL	00:04:46,207	00:04:52,607	| 99pi-0274-theageofthealgorithm-1 |	Accurate that data because those ramen noodle packages
EDL	00:04:52,607	00:04:55,167	| 99pi-0274-theageofthealgorithm-1 |	Exclude
EDL	00:04:55,167	00:04:59,263	| 99pi-0274-theageofthealgorithm-1 |	And therefore imposing my agenda on this algorithm
EDL	00:04:59,263	00:05:01,567	| 99pi-0274-theageofthealgorithm-1 |	In addition to curating the ingredients
EDL	00:05:01,567	00:05:06,175	| 99pi-0274-theageofthealgorithm-1 |	O'Neal as the cook also defines what a successful outcome looks like
EDL	00:05:06,175	00:05:10,527	| 99pi-0274-theageofthealgorithm-1 |	I'm also defining success right I'm in charge of success success
EDL	00:05:11,039	00:05:13,599	| 99pi-0274-theageofthealgorithm-1 |	If my kids eat vegetables at that meal
EDL	00:05:13,599	00:05:16,415	| 99pi-0274-theageofthealgorithm-1 |	We know different cock my define success differently
EDL	00:05:16,415	00:05:19,743	| 99pi-0274-theageofthealgorithm-1 |	Define success to be like
EDL	00:05:22,047	00:05:24,863	| 99pi-0274-theageofthealgorithm-1 |	Impose
EDL	00:05:24,863	00:05:26,399	| 99pi-0274-theageofthealgorithm-1 |	Origin.
EDL	00:05:28,447	00:05:31,519	| 99pi-0274-theageofthealgorithm-1 |	O'Neil's main point here is that our them aren't we object
EDL	00:05:31,519	00:05:33,311	| 99pi-0274-theageofthealgorithm-1 |	Even when they're carried out by computers
EDL	00:05:33,823	00:05:37,663	| 99pi-0274-theageofthealgorithm-1 |	This is relevant because the companies that build them like to Market them as a jacket
EDL	00:05:38,175	00:05:42,271	| 99pi-0274-theageofthealgorithm-1 |	Claiming they remove human error infallibility from complex decision-making
EDL	00:05:42,271	00:05:45,343	| 99pi-0274-theageofthealgorithm-1 |	But every algorithm reflects the priorities and judgments
EDL	00:05:45,343	00:05:46,367	| 99pi-0274-theageofthealgorithm-1 |	David human designer
EDL	00:05:47,135	00:05:50,463	| 99pi-0274-theageofthealgorithm-1 |	Of course that doesn't necessarily make algorithms bad
EDL	00:05:50,463	00:05:53,279	| 99pi-0274-theageofthealgorithm-1 |	Right so I mean it's very important to me that I don't
EDL	00:05:53,279	00:05:55,071	| 99pi-0274-theageofthealgorithm-1 |	Get the reputation of hating allowed
EDL	00:05:55,583	00:05:58,911	| 99pi-0274-theageofthealgorithm-1 |	I actually like algorithms I think algorithms could really help
EDL	00:05:58,911	00:06:02,495	| 99pi-0274-theageofthealgorithm-1 |	Brunilda single out a particular kind of algorithm for scrutiny
EDL	00:06:03,007	00:06:04,799	| 99pi-0274-theageofthealgorithm-1 |	These are the ones we should worry about
EDL	00:06:06,079	00:06:07,871	| 99pi-0274-theageofthealgorithm-1 |	Are characterized by three properties
EDL	00:06:07,871	00:06:12,735	| 99pi-0274-theageofthealgorithm-1 |	That's very widespread and important so it's like they make important decisions about a lot of
EDL	00:06:12,735	00:06:16,831	| 99pi-0274-theageofthealgorithm-1 |	Number to that their secret that the people don't understand how they're being scored
EDL	00:06:17,343	00:06:20,415	| 99pi-0274-theageofthealgorithm-1 |	I never treated their destructive like one bad mistake
EDL	00:06:20,927	00:06:23,999	| 99pi-0274-theageofthealgorithm-1 |	In the in the design if you
EDL	00:06:23,999	00:06:27,071	| 99pi-0274-theageofthealgorithm-1 |	Will actually not only make it unfair for individuals butts
EDL	00:06:27,071	00:06:30,911	| 99pi-0274-theageofthealgorithm-1 |	Categorically unfair enormous populations As It Gets
EDL	00:06:30,911	00:06:31,423	| 99pi-0274-theageofthealgorithm-1 |	Scaled-up
EDL	00:06:32,447	00:06:34,239	| 99pi-0274-theageofthealgorithm-1 |	O'Neill has a shorthand for these algorithms
EDL	00:06:34,751	00:06:37,311	| 99pi-0274-theageofthealgorithm-1 |	The widespread mysterious and destructive
EDL	00:06:38,079	00:06:39,103	| 99pi-0274-theageofthealgorithm-1 |	She calls them
EDL	00:06:39,103	00:06:40,639	| 99pi-0274-theageofthealgorithm-1 |	Weapons of math destruction
EDL	00:06:42,943	00:06:45,503	| 99pi-0274-theageofthealgorithm-1 |	To show how one of these destructive algorithms work
EDL	00:06:46,015	00:06:47,807	| 99pi-0274-theageofthealgorithm-1 |	O'Neal points to criminal justice
EDL	00:06:48,575	00:06:51,391	| 99pi-0274-theageofthealgorithm-1 |	For hundreds of years key decisions in the legal process
EDL	00:06:51,903	00:06:53,183	| 99pi-0274-theageofthealgorithm-1 |	Like a mountain belt
EDL	00:06:53,183	00:06:55,743	| 99pi-0274-theageofthealgorithm-1 |	Sentence and likelihood of parole
EDL	00:06:55,743	00:06:59,071	| 99pi-0274-theageofthealgorithm-1 |	I've been in the hands of fallible human beings Guided by their instinct
EDL	00:06:59,583	00:07:00,095	| 99pi-0274-theageofthealgorithm-1 |	And sometime
EDL	00:07:00,863	00:07:01,375	| 99pi-0274-theageofthealgorithm-1 |	Personal bias
EDL	00:07:01,887	00:07:04,959	| 99pi-0274-theageofthealgorithm-1 |	The judges are super famously race at some of the more than others
EDL	00:07:04,959	00:07:08,543	| 99pi-0274-theageofthealgorithm-1 |	And that racism can produce very different outcomes for defendants
EDL	00:07:08,543	00:07:13,663	| 99pi-0274-theageofthealgorithm-1 |	For example the ACLU has found that sentences imposed on black men in the federal system
EDL	00:07:13,663	00:07:17,759	| 99pi-0274-theageofthealgorithm-1 |	Are nearly 20% longer than those four white men convicted of similar crimes
EDL	00:07:18,271	00:07:23,903	| 99pi-0274-theageofthealgorithm-1 |	And Studies have shown that prosecutors are more likely to seek the death penalty for African Americans that for whites convicted
EDL	00:07:23,903	00:07:24,927	| 99pi-0274-theageofthealgorithm-1 |	The same charges
EDL	00:07:24,927	00:07:29,791	| 99pi-0274-theageofthealgorithm-1 |	So you might think that computerized models fed by data would contribute to more even-handed treatment
EDL	00:07:30,303	00:07:32,607	| 99pi-0274-theageofthealgorithm-1 |	Criminal Justice System think so too
EDL	00:07:32,607	00:07:35,423	| 99pi-0274-theageofthealgorithm-1 |	It is increasingly try to minimize human bias
EDL	00:07:35,423	00:07:36,703	| 99pi-0274-theageofthealgorithm-1 |	By turning to risk
EDL	00:07:36,703	00:07:37,983	| 99pi-0274-theageofthealgorithm-1 |	Assessment algorithm
EDL	00:07:37,983	00:07:42,079	| 99pi-0274-theageofthealgorithm-1 |	Like crime risk what is a chance of someone coming back to prison after leaving it
EDL	00:07:42,079	00:07:45,919	| 99pi-0274-theageofthealgorithm-1 |	Many of these risk algorithms look at a person's record of arrest and conviction
EDL	00:07:46,431	00:07:47,455	| 99pi-0274-theageofthealgorithm-1 |	The problem is
EDL	00:07:47,455	00:07:50,271	| 99pi-0274-theageofthealgorithm-1 |	That data is already skewed by some social realities
EDL	00:07:50,783	00:07:55,647	| 99pi-0274-theageofthealgorithm-1 |	Take for example the fact that white people and black people use marijuana at roughly equal rates
EDL	00:07:55,647	00:07:58,207	| 99pi-0274-theageofthealgorithm-1 |	And yet there's five times as many
EDL	00:07:58,207	00:08:00,767	| 99pi-0274-theageofthealgorithm-1 |	Blacks getting arrested for smoking pot as whites
EDL	00:08:01,535	00:08:02,559	| 99pi-0274-theageofthealgorithm-1 |	5 times as many
EDL	00:08:03,071	00:08:06,399	| 99pi-0274-theageofthealgorithm-1 |	This may be because black neighborhoods tend to be more heavily policed than white nearby
EDL	00:08:06,911	00:08:09,727	| 99pi-0274-theageofthealgorithm-1 |	Which means black people get arrested for certain crimes more often than white
EDL	00:08:10,495	00:08:13,823	| 99pi-0274-theageofthealgorithm-1 |	Risk algorithms detect these patterns and apply them to the Future
EDL	00:08:14,335	00:08:17,151	| 99pi-0274-theageofthealgorithm-1 |	So the past is shaped in part by racism
EDL	00:08:17,151	00:08:18,687	| 99pi-0274-theageofthealgorithm-1 |	The future will be to
EDL	00:08:18,687	00:08:21,247	| 99pi-0274-theageofthealgorithm-1 |	The larger point is we have terrible date
EDL	00:08:22,527	00:08:24,063	| 99pi-0274-theageofthealgorithm-1 |	For the statisticians
EDL	00:08:24,063	00:08:29,439	| 99pi-0274-theageofthealgorithm-1 |	Involve the data scientist are like bliley going forward and pretending that our data is good
EDL	00:08:29,951	00:08:33,279	| 99pi-0274-theageofthealgorithm-1 |	And they were using it to actually make important decisions
EDL	00:08:33,279	00:08:39,423	| 99pi-0274-theageofthealgorithm-1 |	Risk assessment algorithm is also look at defendants answers to a questionnaire that supposed to tease out certain risk
EDL	00:08:39,423	00:08:42,239	| 99pi-0274-theageofthealgorithm-1 |	Understand questions like you know did you grow up in high-crime neighborhood
EDL	00:08:43,007	00:08:46,847	| 99pi-0274-theageofthealgorithm-1 |	Are you on welfare do you have a mental health problem do you have addiction problems
EDL	00:08:46,847	00:08:48,383	| 99pi-0274-theageofthealgorithm-1 |	Did your father go to prison
EDL	00:08:48,383	00:08:50,431	| 99pi-0274-theageofthealgorithm-1 |	Eproxies for racing class
EDL	00:08:51,199	00:08:54,015	| 99pi-0274-theageofthealgorithm-1 |	What is embedded in the scoring system and the judge is
EDL	00:08:54,015	00:08:56,831	| 99pi-0274-theageofthealgorithm-1 |	Given the score and it's called objective what is
EDL	00:08:57,343	00:08:58,111	| 99pi-0274-theageofthealgorithm-1 |	What is a
EDL	00:08:58,111	00:09:03,743	| 99pi-0274-theageofthealgorithm-1 |	Judge take away from it or you know how is it used if you have a high risk to send you to prison for longer
EDL	00:09:03,743	00:09:04,767	| 99pi-0274-theageofthealgorithm-1 |	Incessant
EDL	00:09:04,767	00:09:09,887	| 99pi-0274-theageofthealgorithm-1 |	Is also it's also used in bail hearings and parole hearings you have a high recidivism score
EDL	00:09:09,887	00:09:10,911	| 99pi-0274-theageofthealgorithm-1 |	You don't get girl
EDL	00:09:12,447	00:09:14,751	| 99pi-0274-theageofthealgorithm-1 |	And presumably you can take all that bias
EDL	00:09:14,751	00:09:15,519	| 99pi-0274-theageofthealgorithm-1 |	Import data
EDL	00:09:16,287	00:09:16,799	| 99pi-0274-theageofthealgorithm-1 |	And say
EDL	00:09:17,311	00:09:18,847	| 99pi-0274-theageofthealgorithm-1 |	This High chance recidivism
EDL	00:09:19,359	00:09:20,639	| 99pi-0274-theageofthealgorithm-1 |	Means that we should
EDL	00:09:20,639	00:09:21,663	| 99pi-0274-theageofthealgorithm-1 |	Rehabilitate
EDL	00:09:21,663	00:09:27,295	| 99pi-0274-theageofthealgorithm-1 |	I mean that you can take that pill that same stuff and choose to do a completely different thing with the result of the algorithm
EDL	00:09:27,295	00:09:29,855	| 99pi-0274-theageofthealgorithm-1 |	That's exactly my point exactly my point
EDL	00:09:29,855	00:09:35,743	| 99pi-0274-theageofthealgorithm-1 |	Say oh I wonder why people who have this characteristic have so much worse recidivism well
EDL	00:09:35,743	00:09:38,303	| 99pi-0274-theageofthealgorithm-1 |	Let's try to help them find a job that'll help
EDL	00:09:38,815	00:09:41,631	| 99pi-0274-theageofthealgorithm-1 |	We could use those algorithms those risk scores
EDL	00:09:42,143	00:09:45,471	| 99pi-0274-theageofthealgorithm-1 |	To try to account for our society
EDL	00:09:45,983	00:09:52,383	| 99pi-0274-theageofthealgorithm-1 |	Instead O'Neill says in many cases were effectively penalizing people for societal and structural issues that they have live
EDL	00:09:52,383	00:09:53,407	| 99pi-0274-theageofthealgorithm-1 |	Little control over
EDL	00:09:53,407	00:09:55,455	| 99pi-0274-theageofthealgorithm-1 |	And we're doing it at a massive scale
EDL	00:09:55,455	00:09:57,759	| 99pi-0274-theageofthealgorithm-1 |	Using these new technological tools
EDL	00:09:57,759	00:10:03,903	| 99pi-0274-theageofthealgorithm-1 |	We're Shifting the blame if you will from the society which is the one that should only has problems to the individual and
EDL	00:10:05,439	00:10:10,559	| 99pi-0274-theageofthealgorithm-1 |	It should be said that and some cases algorithms are helping to change elements of the criminal justice system for the better
EDL	00:10:11,071	00:10:13,887	| 99pi-0274-theageofthealgorithm-1 |	For example New Jersey recently did away with their cash bail system
EDL	00:10:14,399	00:10:16,447	| 99pi-0274-theageofthealgorithm-1 |	Which disadvantage low-income defendant
EDL	00:10:16,959	00:10:19,263	| 99pi-0274-theageofthealgorithm-1 |	They now rely on predictive algorithms instead
EDL	00:10:19,775	00:10:21,311	| 99pi-0274-theageofthealgorithm-1 |	Data shows that the states
EDL	00:10:21,311	00:10:25,151	| 99pi-0274-theageofthealgorithm-1 |	Pretrial County Jail populations are down by about 20%
EDL	00:10:27,711	00:10:31,295	| 99pi-0274-theageofthealgorithm-1 |	But still algorithms like that one remain unaudited and unregulated
EDL	00:10:31,807	00:10:34,623	| 99pi-0274-theageofthealgorithm-1 |	And it's a problem when algorithms are basically black boxes
EDL	00:10:35,135	00:10:39,487	| 99pi-0274-theageofthealgorithm-1 |	In many cases they're designed by private companies who sell them to other companies
EDL	00:10:39,487	00:10:40,767	| 99pi-0274-theageofthealgorithm-1 |	Any exact details
EDL	00:10:40,767	00:10:41,279	| 99pi-0274-theageofthealgorithm-1 |	And how they work
EDL	00:10:41,791	00:10:42,559	| 99pi-0274-theageofthealgorithm-1 |	Secret
EDL	00:10:42,559	00:10:46,399	| 99pi-0274-theageofthealgorithm-1 |	Not only the public in the dark even the companies using these things
EDL	00:10:46,399	00:10:49,215	| 99pi-0274-theageofthealgorithm-1 |	Might not understand exactly how the data is being processed
EDL	00:10:49,727	00:10:53,055	| 99pi-0274-theageofthealgorithm-1 |	This is true of many of the problematic algorithms that O'Neill has looked at
EDL	00:10:53,567	00:10:55,871	| 99pi-0274-theageofthealgorithm-1 |	Whether they use for sorting loan applications
EDL	00:10:55,871	00:10:56,895	| 99pi-0274-theageofthealgorithm-1 |	We're assessing teacher before
EDL	00:10:57,407	00:11:00,735	| 99pi-0274-theageofthealgorithm-1 |	Is there some kind of weird thing that happens to people
EDL	00:11:00,735	00:11:02,527	| 99pi-0274-theageofthealgorithm-1 |	In mathematical scores are trotted out
EDL	00:11:03,295	00:11:04,319	| 99pi-0274-theageofthealgorithm-1 |	They just start
EDL	00:11:04,831	00:11:07,647	| 99pi-0274-theageofthealgorithm-1 |	Closing their eyes and believing it because it's math
EDL	00:11:08,415	00:11:11,231	| 99pi-0274-theageofthealgorithm-1 |	And they do I feel like I know I'm not an expert of math so
EDL	00:11:11,743	00:11:12,767	| 99pi-0274-theageofthealgorithm-1 |	I can't push back
EDL	00:11:13,535	00:11:19,423	| 99pi-0274-theageofthealgorithm-1 |	And that's not something you just see time and time again you're like why didn't you question that this doesn't make sense
EDL	00:11:19,423	00:11:20,959	| 99pi-0274-theageofthealgorithm-1 |	Oh well it's math and I don't understand it
EDL	00:11:21,727	00:11:22,751	| 99pi-0274-theageofthealgorithm-1 |	Right now it seems like
EDL	00:11:23,263	00:11:25,311	| 99pi-0274-theageofthealgorithm-1 |	Because of algorithms in math
EDL	00:11:25,823	00:11:27,615	| 99pi-0274-theageofthealgorithm-1 |	It's just a new place
EDL	00:11:27,615	00:11:28,383	| 99pi-0274-theageofthealgorithm-1 |	2
EDL	00:11:28,383	00:11:29,407	| 99pi-0274-theageofthealgorithm-1 |	Place blame
EDL	00:11:30,175	00:11:32,223	| 99pi-0274-theageofthealgorithm-1 |	So that you do not have to think about
