EDL	Record In	Record Out	Clipname	Subtitle
EDL	00:00:01,024	00:00:03,840	| 99pi-0086-reversaloffortune-1 |	99percentinvisible is brought to you by Progressive
EDL	00:00:03,840	00:00:06,144	| 99pi-0086-reversaloffortune-1 |	One of the country's leading providers of auto insurance
EDL	00:00:06,656	00:00:08,960	| 99pi-0086-reversaloffortune-1 |	With progressives Name Your Price tool
EDL	00:00:08,960	00:00:15,104	| 99pi-0086-reversaloffortune-1 |	You can say what kind of coverage were looking for and how much you want to pay and Progressive will show you options that fit within your budget
EDL	00:00:15,616	00:00:18,944	| 99pi-0086-reversaloffortune-1 |	Use the Name Your Price tool and start an online quote today
EDL	00:00:18,944	00:00:19,968	| 99pi-0086-reversaloffortune-1 |	Progressive.com
EDL	00:00:20,480	00:00:22,784	| 99pi-0086-reversaloffortune-1 |	Price in coverage match limited by state law
EDL	00:00:24,832	00:00:25,600	| 99pi-0086-reversaloffortune-1 |	Family ghosts
EDL	00:00:25,600	00:00:31,232	| 99pi-0086-reversaloffortune-1 |	Is a podcast explores all the unexpected ways our family structure and shape our view of the world
EDL	00:00:31,744	00:00:33,280	| 99pi-0086-reversaloffortune-1 |	Each episode of Family ghost
EDL	00:00:33,280	00:00:37,376	| 99pi-0086-reversaloffortune-1 |	Takes a look at the story behind a different person's family lore
EDL	00:00:37,376	00:00:40,192	| 99pi-0086-reversaloffortune-1 |	Digging into unanswered questions about their history
EDL	00:00:40,192	00:00:42,752	| 99pi-0086-reversaloffortune-1 |	Season 2 Launches on May 15th
EDL	00:00:42,752	00:00:46,080	| 99pi-0086-reversaloffortune-1 |	Between episode where they take you inside the love Israel family called
EDL	00:00:46,080	00:00:50,688	| 99pi-0086-reversaloffortune-1 |	An episode about uncovering the secrets scrolled in a newly discovered stack of Love Letters
EDL	00:00:50,688	00:00:57,088	| 99pi-0086-reversaloffortune-1 |	Asuna episode that brings you along to the hunt for a container of missing Chinese food that's haunted a family
EDL	00:00:57,088	00:00:58,368	| 99pi-0086-reversaloffortune-1 |	For 25 years
EDL	00:00:58,368	00:00:58,880	| 99pi-0086-reversaloffortune-1 |	And more
EDL	00:00:59,392	00:01:03,488	| 99pi-0086-reversaloffortune-1 |	Subscribe to family goes wherever you get your podcast and find out why they say
EDL	00:01:03,488	00:01:04,768	| 99pi-0086-reversaloffortune-1 |	Every house is haunted
EDL	00:01:06,048	00:01:08,352	| 99pi-0086-reversaloffortune-1 |	This is 99% invisible
EDL	00:01:08,352	00:01:09,120	| 99pi-0086-reversaloffortune-1 |	I'm Roman Mars
EDL	00:01:10,656	00:01:12,704	| 99pi-0086-reversaloffortune-1 |	I fell in love with architecture
EDL	00:01:12,704	00:01:13,728	| 99pi-0086-reversaloffortune-1 |	On the Chicago River
EDL	00:01:14,240	00:01:16,544	| 99pi-0086-reversaloffortune-1 |	You can endlessly argue about which
EDL	00:01:16,544	00:01:18,080	| 99pi-0086-reversaloffortune-1 |	City has the greatest architecture
EDL	00:01:18,592	00:01:21,408	| 99pi-0086-reversaloffortune-1 |	One thing that puts Chicago near the top for me
EDL	00:01:21,920	00:01:25,504	| 99pi-0086-reversaloffortune-1 |	Is that the Chicago River provides a beautiful vantage point
EDL	00:01:25,504	00:01:27,552	| 99pi-0086-reversaloffortune-1 |	To take in all the Marvel is skyscraper
EDL	00:01:28,320	00:01:34,464	| 99pi-0086-reversaloffortune-1 |	Rather than being crammed in on the sidewalk between looming Towers trying and probably failing to take it all in
EDL	00:01:35,232	00:01:36,256	| 99pi-0086-reversaloffortune-1 |	The river
EDL	00:01:36,256	00:01:37,792	| 99pi-0086-reversaloffortune-1 |	Pushes the buildings apart
EDL	00:01:38,304	00:01:42,144	| 99pi-0086-reversaloffortune-1 |	And gives you the opportunity to post by on the roof of a fairy
EDL	00:01:42,144	00:01:43,168	| 99pi-0086-reversaloffortune-1 |	Glass
EDL	00:01:43,168	00:01:44,960	| 99pi-0086-reversaloffortune-1 |	Steel and concrete wonders
EDL	00:01:44,960	00:01:47,008	| 99pi-0086-reversaloffortune-1 |	Presented in their full Glory
EDL	00:01:47,008	00:01:48,288	| 99pi-0086-reversaloffortune-1 |	Everywhere you turn
EDL	00:01:49,056	00:01:52,896	| 99pi-0086-reversaloffortune-1 |	The probably the city's biggest design a team and isn't a building at all
EDL	00:01:53,408	00:01:55,200	| 99pi-0086-reversaloffortune-1 |	It's that River itself
EDL	00:01:55,200	00:01:58,272	| 99pi-0086-reversaloffortune-1 |	Waterway disguised as a remnant of a natural landscape
EDL	00:01:58,784	00:01:59,552	| 99pi-0086-reversaloffortune-1 |	But it really isn't
EDL	00:02:00,064	00:02:03,136	| 99pi-0086-reversaloffortune-1 |	It's hard to tell when you see the river but it's going the wrong way
EDL	00:02:03,136	00:02:04,672	| 99pi-0086-reversaloffortune-1 |	It should flow into Lake Michigan
EDL	00:02:05,184	00:02:05,952	| 99pi-0086-reversaloffortune-1 |	Pennsaid
EDL	00:02:05,952	00:02:08,256	| 99pi-0086-reversaloffortune-1 |	Fresh water from Lake Michigan flows backward
EDL	00:02:08,768	00:02:09,536	| 99pi-0086-reversaloffortune-1 |	Into the city
EDL	00:02:10,304	00:02:15,168	| 99pi-0086-reversaloffortune-1 |	The Chicago River is the large part A carefully-designed extension of the city sewer system
EDL	00:02:15,680	00:02:17,728	| 99pi-0086-reversaloffortune-1 |	Even calling it a river may be off base
EDL	00:02:18,240	00:02:22,848	| 99pi-0086-reversaloffortune-1 |	It's not really a river in Chicago it's really the Chicago canal
EDL	00:02:22,848	00:02:25,920	| 99pi-0086-reversaloffortune-1 |	There's not an inch I don't think of the Chicago River that is natural inches
EDL	00:02:27,456	00:02:28,480	| 99pi-0086-reversaloffortune-1 |	Death Richard cahan
EDL	00:02:28,480	00:02:30,784	| 99pi-0086-reversaloffortune-1 |	He's a journalist and historian in Chicago
EDL	00:02:30,784	00:02:34,880	| 99pi-0086-reversaloffortune-1 |	And in 2012 he co-wrote and published a book called The Lost panorama
EDL	00:02:35,392	00:02:37,952	| 99pi-0086-reversaloffortune-1 |	When Chicago changed its River in the land Beyond
EDL	00:02:37,952	00:02:41,792	| 99pi-0086-reversaloffortune-1 |	It's still with these gorgeous pictures from before and mostly after
EDL	00:02:41,792	00:02:44,096	| 99pi-0086-reversaloffortune-1 |	One of the biggest Urban Design project
EDL	00:02:44,096	00:02:44,864	| 99pi-0086-reversaloffortune-1 |	Ever
EDL	00:02:44,864	00:02:45,888	| 99pi-0086-reversaloffortune-1 |	The reversal
EDL	00:02:45,888	00:02:47,168	| 99pi-0086-reversaloffortune-1 |	And a complete transformation
EDL	00:02:47,680	00:02:48,448	| 99pi-0086-reversaloffortune-1 |	Are the Chicago River
EDL	00:02:48,448	00:02:49,984	| 99pi-0086-reversaloffortune-1 |	And that is Dan Weisman
EDL	00:02:49,984	00:02:51,008	| 99pi-0086-reversaloffortune-1 |	The journalist
EDL	00:02:51,008	00:02:52,544	| 99pi-0086-reversaloffortune-1 |	Moreau triangular buildings
EDL	00:02:52,544	00:02:53,824	| 99pi-0086-reversaloffortune-1 |	A lifelong
EDL	00:02:53,824	00:02:54,592	| 99pi-0086-reversaloffortune-1 |	Die Hard
EDL	00:02:54,592	00:02:55,360	| 99pi-0086-reversaloffortune-1 |	Chicago
EDL	00:02:55,360	00:02:59,968	| 99pi-0086-reversaloffortune-1 |	Reversing the river was actually the third in the series of Epic design project
EDL	00:02:59,968	00:03:01,248	| 99pi-0086-reversaloffortune-1 |	Almost 50 years
EDL	00:03:02,016	00:03:05,600	| 99pi-0086-reversaloffortune-1 |	Three projects that I melted to 19th century Engineers just
EDL	00:03:05,600	00:03:12,000	| 99pi-0086-reversaloffortune-1 |	Taking it to the laws of nature with a kind of moxie but just seems to be folded into the DNA of 19th century
EDL	00:03:12,000	00:03:12,512	| 99pi-0086-reversaloffortune-1 |	Engineers
EDL	00:03:13,024	00:03:14,816	| 99pi-0086-reversaloffortune-1 |	And which is the first two
EDL	00:03:14,816	00:03:17,888	| 99pi-0086-reversaloffortune-1 |	We're talking about two decades of massive ridiculous
EDL	00:03:17,888	00:03:22,240	| 99pi-0086-reversaloffortune-1 |	Change people's ideas of how far you could go to make a city work
EDL	00:03:22,240	00:03:25,056	| 99pi-0086-reversaloffortune-1 |	And those two have been so obscured by time
EDL	00:03:25,056	00:03:31,456	| 99pi-0086-reversaloffortune-1 |	It was basically one guy who proposed and executed not one but two of these
EDL	00:03:31,456	00:03:32,480	| 99pi-0086-reversaloffortune-1 |	Project
EDL	00:03:32,480	00:03:33,760	| 99pi-0086-reversaloffortune-1 |	Unknown today
EDL	00:03:34,784	00:03:35,552	| 99pi-0086-reversaloffortune-1 |	Ellis chesbrough
EDL	00:03:36,320	00:03:38,368	| 99pi-0086-reversaloffortune-1 |	If you've never heard of Ellis chesbrough
EDL	00:03:38,368	00:03:41,952	| 99pi-0086-reversaloffortune-1 |	You're not allowed to talk to his I record this he doesn't even have a Wikipedia entry
EDL	00:03:41,952	00:03:42,976	| 99pi-0086-reversaloffortune-1 |	But you can bet
EDL	00:03:42,976	00:03:44,256	| 99pi-0086-reversaloffortune-1 |	Richard Kane knows who he is
EDL	00:03:44,768	00:03:50,656	| 99pi-0086-reversaloffortune-1 |	So he was a star and there is to his house is just North of downtown and there's a little plaque in for the house I was parked my car in front of it
EDL	00:03:51,936	00:03:56,800	| 99pi-0086-reversaloffortune-1 |	And it says House of Alice chesbro and I'm sure I'm the only person that ever was very excited about seeing it
EDL	00:03:57,312	00:03:59,360	| 99pi-0086-reversaloffortune-1 |	Stop back in the 1800s
EDL	00:03:59,360	00:04:00,640	| 99pi-0086-reversaloffortune-1 |	Chesbro with the man
EDL	00:04:01,152	00:04:03,200	| 99pi-0086-reversaloffortune-1 |	And no one has ever worked harder
EDL	00:04:03,200	00:04:04,736	| 99pi-0086-reversaloffortune-1 |	To save Chicago from its own poop
EDL	00:04:08,064	00:04:11,392	| 99pi-0086-reversaloffortune-1 |	Poop butt thing that has brought cities to their knees
EDL	00:04:11,392	00:04:11,904	| 99pi-0086-reversaloffortune-1 |	For millennia
EDL	00:04:12,672	00:04:13,696	| 99pi-0086-reversaloffortune-1 |	Now here's the setup
EDL	00:04:13,696	00:04:14,720	| 99pi-0086-reversaloffortune-1 |	It 1854
EDL	00:04:15,232	00:04:18,047	| 99pi-0086-reversaloffortune-1 |	City of Chicago has been growing like crazy for a couple of decades
EDL	00:04:19,327	00:04:23,167	| 99pi-0086-reversaloffortune-1 |	Cute bun with a W population every few years
EDL	00:04:24,191	00:04:24,703	| 99pi-0086-reversaloffortune-1 |	Call Rapids
EDL	00:04:25,727	00:04:26,495	| 99pi-0086-reversaloffortune-1 |	Wiped out
EDL	00:04:26,495	00:04:28,543	| 99pi-0086-reversaloffortune-1 |	6% of the city 6%
EDL	00:04:29,055	00:04:30,079	| 99pi-0086-reversaloffortune-1 |	That summer
EDL	00:04:30,079	00:04:32,127	| 99pi-0086-reversaloffortune-1 |	One account headcollar killing six
EDL	00:04:32,127	00:04:34,943	| 99pi-0086-reversaloffortune-1 |	60 people a day in a town of 70000
EDL	00:04:35,711	00:04:36,735	| 99pi-0086-reversaloffortune-1 |	One of the Republic this way
EDL	00:04:37,503	00:04:39,807	| 99pi-0086-reversaloffortune-1 |	The death cart was constantly in the street
EDL	00:04:40,575	00:04:42,111	| 99pi-0086-reversaloffortune-1 |	And not to be gross
EDL	00:04:42,111	00:04:42,879	| 99pi-0086-reversaloffortune-1 |	The caller
EDL	00:04:42,879	00:04:45,183	| 99pi-0086-reversaloffortune-1 |	It is a super nasty way to go
EDL	00:04:45,183	00:04:45,951	| 99pi-0086-reversaloffortune-1 |	Sudden
EDL	00:04:45,951	00:04:46,719	| 99pi-0086-reversaloffortune-1 |	Painful in love
EDL	00:04:47,231	00:04:47,743	| 99pi-0086-reversaloffortune-1 |	Ropes
EDL	00:04:48,255	00:04:51,839	| 99pi-0086-reversaloffortune-1 |	Vomiting diarrhea horrible cramps in your dead in less than a day
EDL	00:04:51,839	00:04:53,119	| 99pi-0086-reversaloffortune-1 |	It is a really
EDL	00:04:53,119	00:04:54,399	| 99pi-0086-reversaloffortune-1 |	Really unpleasant
EDL	00:04:55,423	00:04:57,215	| 99pi-0086-reversaloffortune-1 |	The people were freaking out
EDL	00:04:57,727	00:04:58,751	| 99pi-0086-reversaloffortune-1 |	Interchez bro
EDL	00:04:58,751	00:05:00,799	| 99pi-0086-reversaloffortune-1 |	Amanda name with work he done in Boston
EDL	00:05:00,799	00:05:03,359	| 99pi-0086-reversaloffortune-1 |	Will you people meet Old Chicago is a sewer
EDL	00:05:03,871	00:05:05,919	| 99pi-0086-reversaloffortune-1 |	Which was actually a newish idea.
EDL	00:05:05,919	00:05:06,943	| 99pi-0086-reversaloffortune-1 |	The time in the US
EDL	00:05:06,943	00:05:08,479	| 99pi-0086-reversaloffortune-1 |	Northern City here at 1
EDL	00:05:08,479	00:05:09,503	| 99pi-0086-reversaloffortune-1 |	Seward's yes
EDL	00:05:09,503	00:05:13,599	| 99pi-0086-reversaloffortune-1 |	Systems not so much in Chicago didn't seem like the town you picked to go first
EDL	00:05:14,111	00:05:16,159	| 99pi-0086-reversaloffortune-1 |	Not if you thought typography meant any
EDL	00:05:16,159	00:05:17,951	| 99pi-0086-reversaloffortune-1 |	Chicago built on a swamp
EDL	00:05:17,951	00:05:18,719	| 99pi-0086-reversaloffortune-1 |	Street-level
EDL	00:05:18,719	00:05:19,487	| 99pi-0086-reversaloffortune-1 |	Water level
EDL	00:05:19,487	00:05:20,767	| 99pi-0086-reversaloffortune-1 |	What's the same thing
EDL	00:05:20,767	00:05:25,887	| 99pi-0086-reversaloffortune-1 |	You put Seward under the street there's no way for the material in them do you know run down peeling dead
EDL	00:05:26,399	00:05:32,287	| 99pi-0086-reversaloffortune-1 |	Chicago was ready to try anything
EDL	00:05:32,287	00:05:33,823	| 99pi-0086-reversaloffortune-1 |	Chesbro said okay
EDL	00:05:33,823	00:05:35,871	| 99pi-0086-reversaloffortune-1 |	What's Jack street level up Tempe
EDL	00:05:35,871	00:05:39,711	| 99pi-0086-reversaloffortune-1 |	It was a time when engineers' were really seen as the savior
EDL	00:05:40,223	00:05:42,783	| 99pi-0086-reversaloffortune-1 |	It's so when he said first thought they were going to build a sewer system
EDL	00:05:43,295	00:05:46,367	| 99pi-0086-reversaloffortune-1 |	And he said we're going to raise Chicago out 10 ft so that we can
EDL	00:05:47,135	00:05:47,903	| 99pi-0086-reversaloffortune-1 |	Wooden sword
EDL	00:05:48,927	00:05:51,487	| 99pi-0086-reversaloffortune-1 |	Everyone should let's do it
EDL	00:05:51,487	00:05:53,535	| 99pi-0086-reversaloffortune-1 |	And there was a reason they went for it
EDL	00:05:53,535	00:05:55,327	| 99pi-0086-reversaloffortune-1 |	People making tons of money
EDL	00:05:55,327	00:05:57,119	| 99pi-0086-reversaloffortune-1 |	Chicago's location with perfect
EDL	00:05:57,119	00:06:02,495	| 99pi-0086-reversaloffortune-1 |	Connecting the west to east through railroads in the Great Lakes and that's what the city was growing so fast that start with
EDL	00:06:02,495	00:06:07,871	| 99pi-0086-reversaloffortune-1 |	Actually didn't jack up the street from cells they just pile dirt on top of the old streets to make them higher
EDL	00:06:07,871	00:06:10,943	| 99pi-0086-reversaloffortune-1 |	And some of that dirt came from the river bottom which of the
EDL	00:06:10,943	00:06:12,479	| 99pi-0086-reversaloffortune-1 |	Dredge to make room for
EDL	00:06:12,479	00:06:15,295	| 99pi-0086-reversaloffortune-1 |	All of the stuff that they were about to dump in there
EDL	00:06:15,807	00:06:17,343	| 99pi-0086-reversaloffortune-1 |	They did Jack up the building
EDL	00:06:17,855	00:06:21,951	| 99pi-0086-reversaloffortune-1 |	Literally has a lot of Jack Spurs and start cranking
EDL	00:06:22,463	00:06:28,607	| 99pi-0086-reversaloffortune-1 |	Bisquick picture for 1857 it shows a massive Hotel big is a city block
EDL	00:06:29,631	00:06:31,935	| 99pi-0086-reversaloffortune-1 |	Dozens and dozens of guys crank
EDL	00:06:31,935	00:06:32,447	| 99pi-0086-reversaloffortune-1 |	Perfect sink
EDL	00:06:34,751	00:06:39,359	| 99pi-0086-reversaloffortune-1 |	You can also see Hotel guests in Top Hat standing on the balconies a couple flights up
EDL	00:06:39,871	00:06:42,943	| 99pi-0086-reversaloffortune-1 |	They're looking out watching their view get better and better
EDL	00:06:43,455	00:06:44,735	| 99pi-0086-reversaloffortune-1 |	Corduroy hats at a time
EDL	00:06:45,247	00:06:50,623	| 99pi-0086-reversaloffortune-1 |	And this kind of thing happen over and staying open while they're getting cranked up Just for kicks
EDL	00:06:51,135	00:06:52,671	| 99pi-0086-reversaloffortune-1 |	Another fancy hotel
EDL	00:06:52,671	00:06:53,951	| 99pi-0086-reversaloffortune-1 |	1200 guys
EDL	00:06:53,951	00:06:55,231	| 99pi-0086-reversaloffortune-1 |	Cranking away all at once
EDL	00:06:56,767	00:07:02,911	| 99pi-0086-reversaloffortune-1 |	Foundation at top speed literally working around the guys with the jacks
EDL	00:07:03,423	00:07:08,031	| 99pi-0086-reversaloffortune-1 |	Did another great picture of a huge downtown block of stores in Austin
EDL	00:07:08,543	00:07:10,335	| 99pi-0086-reversaloffortune-1 |	All 35000 tons
EDL	00:07:11,103	00:07:12,895	| 99pi-0086-reversaloffortune-1 |	Jacking up the street and Building Supply
EDL	00:07:12,895	00:07:14,175	| 99pi-0086-reversaloffortune-1 |	20 years to finish
EDL	00:07:14,175	00:07:16,991	| 99pi-0086-reversaloffortune-1 |	But by that time project number 2 with already done
EDL	00:07:16,991	00:07:23,391	| 99pi-0086-reversaloffortune-1 |	Because it didn't take too long after the sewers went in for Chicago to realize that there was a big question that they hadn't given enough
EDL	00:07:23,391	00:07:24,927	| 99pi-0086-reversaloffortune-1 |	Start 2 on the first go-round
EDL	00:07:24,927	00:07:26,719	| 99pi-0086-reversaloffortune-1 |	We're did the sewers take all this out
EDL	00:07:27,231	00:07:27,999	| 99pi-0086-reversaloffortune-1 |	Into the river
EDL	00:07:27,999	00:07:28,767	| 99pi-0086-reversaloffortune-1 |	And where the river
EDL	00:07:28,767	00:07:31,839	| 99pi-0086-reversaloffortune-1 |	And it'll wake and where was the drinking water coming
EDL	00:07:34,143	00:07:35,679	| 99pi-0086-reversaloffortune-1 |	It's okay such as bro how about this
EDL	00:07:36,191	00:07:37,471	| 99pi-0086-reversaloffortune-1 |	Who build water intake
EDL	00:07:37,983	00:07:39,775	| 99pi-0086-reversaloffortune-1 |	2 miles out from Shore
EDL	00:07:39,775	00:07:41,311	| 99pi-0086-reversaloffortune-1 |	Way past where the river
EDL	00:07:41,823	00:07:43,359	| 99pi-0086-reversaloffortune-1 |	Don't turn Mac into the lake
EDL	00:07:43,359	00:07:46,943	| 99pi-0086-reversaloffortune-1 |	And I don't mean digging the biggest deepest longest tunnel Everett
EDL	00:07:47,967	00:07:48,735	| 99pi-0086-reversaloffortune-1 |	What do you think
EDL	00:07:48,735	00:07:53,599	| 99pi-0086-reversaloffortune-1 |	They all said fine and they did it and it was amazing the city is growing people making money
EDL	00:07:53,599	00:07:56,159	| 99pi-0086-reversaloffortune-1 |	And everybody agrees they'll do whatever it takes
EDL	00:07:56,159	00:07:57,183	| 99pi-0086-reversaloffortune-1 |	Keep this thing rolling
EDL	00:07:57,183	00:07:58,975	| 99pi-0086-reversaloffortune-1 |	So it's on round 2
EDL	00:07:58,975	00:08:00,255	| 99pi-0086-reversaloffortune-1 |	Digging the tunnel
EDL	00:08:00,255	00:08:01,791	| 99pi-0086-reversaloffortune-1 |	In 1864
EDL	00:08:01,791	00:08:02,815	| 99pi-0086-reversaloffortune-1 |	Checkers guide
EDL	00:08:02,815	00:08:04,607	| 99pi-0086-reversaloffortune-1 |	Start digging the tunnel out from the city
EDL	00:08:04,607	00:08:06,143	| 99pi-0086-reversaloffortune-1 |	60 feet down from street level
EDL	00:08:06,911	00:08:07,935	| 99pi-0086-reversaloffortune-1 |	After that
EDL	00:08:07,935	00:08:09,983	| 99pi-0086-reversaloffortune-1 |	Install a giant structure
EDL	00:08:09,983	00:08:12,031	| 99pi-0086-reversaloffortune-1 |	2 miles out in the lake they call them
EDL	00:08:12,031	00:08:15,359	| 99pi-0086-reversaloffortune-1 |	Crabs and start digging a tunnel in from under that
EDL	00:08:15,359	00:08:16,383	| 99pi-0086-reversaloffortune-1 |	Back towards Shore
EDL	00:08:16,383	00:08:18,943	| 99pi-0086-reversaloffortune-1 |	The work went on around the clock from both sides
EDL	00:08:18,943	00:08:21,503	| 99pi-0086-reversaloffortune-1 |	One true dug by hand for 16 hours a day
EDL	00:08:21,503	00:08:23,039	| 99pi-0086-reversaloffortune-1 |	Tentacruel bricklayers
EDL	00:08:23,039	00:08:26,879	| 99pi-0086-reversaloffortune-1 |	The graveyard shift showing up the area that had just been dug out
EDL	00:08:26,879	00:08:28,159	| 99pi-0086-reversaloffortune-1 |	In November 1860
EDL	00:08:28,159	00:08:29,439	| 99pi-0086-reversaloffortune-1 |	5 the two sets
EDL	00:08:29,439	00:08:31,487	| 99pi-0086-reversaloffortune-1 |	Ted Cruz net in the middle
EDL	00:08:32,511	00:08:34,815	| 99pi-0086-reversaloffortune-1 |	Center this is before GPS
EDL	00:08:35,327	00:08:37,375	| 99pi-0086-reversaloffortune-1 |	You know this is just Ball by side
EDL	00:08:37,375	00:08:39,167	| 99pi-0086-reversaloffortune-1 |	Everybody agreed with a
EDL	00:08:39,167	00:08:40,447	| 99pi-0086-reversaloffortune-1 |	Genius and a half
EDL	00:08:40,447	00:08:42,495	| 99pi-0086-reversaloffortune-1 |	Except they hadn't really solve the problem
EDL	00:08:46,591	00:08:48,639	| 99pi-0086-reversaloffortune-1 |	And they were dumping more
EDL	00:08:49,151	00:08:51,455	| 99pi-0086-reversaloffortune-1 |	Of their business into the river than ever
EDL	00:08:51,455	00:08:52,223	| 99pi-0086-reversaloffortune-1 |	Which
EDL	00:08:52,223	00:08:52,735	| 99pi-0086-reversaloffortune-1 |	Stank
EDL	00:08:53,247	00:08:56,063	| 99pi-0086-reversaloffortune-1 |	And before the water for the new intakes even started flowing
EDL	00:08:56,063	00:08:59,391	| 99pi-0086-reversaloffortune-1 |	The union Stockyards open on the River South Branch
EDL	00:08:59,391	00:08:59,903	| 99pi-0086-reversaloffortune-1 |	Up the ante
EDL	00:09:01,183	00:09:05,535	| 99pi-0086-reversaloffortune-1 |	320 Acres of slaughterhouses and meat packing plants
EDL	00:09:05,535	00:09:06,559	| 99pi-0086-reversaloffortune-1 |	All of them
EDL	00:09:06,559	00:09:08,095	| 99pi-0086-reversaloffortune-1 |	Dumping whatever they couldn't use and
EDL	00:09:08,607	00:09:10,143	| 99pi-0086-reversaloffortune-1 |	Just imagine what that would be
EDL	00:09:10,911	00:09:11,679	| 99pi-0086-reversaloffortune-1 |	Into the river
EDL	00:09:11,679	00:09:13,727	| 99pi-0086-reversaloffortune-1 |	For the estimated the Stockyards were
EDL	00:09:13,727	00:09:14,495	| 99pi-0086-reversaloffortune-1 |	The equivalent of a
EDL	00:09:16,287	00:09:18,335	| 99pi-0086-reversaloffortune-1 |	A million people in the city
EDL	00:09:18,847	00:09:19,871	| 99pi-0086-reversaloffortune-1 |	Yeah that's true
EDL	00:09:20,383	00:09:23,199	| 99pi-0086-reversaloffortune-1 |	That bit of the South Fork still goes by the name and got then
EDL	00:09:23,711	00:09:24,735	| 99pi-0086-reversaloffortune-1 |	Bubbly Creek
EDL	00:09:24,735	00:09:28,063	| 99pi-0086-reversaloffortune-1 |	All the discarded animal stop wood rot at the bottom of the river
EDL	00:09:28,063	00:09:31,391	| 99pi-0086-reversaloffortune-1 |	And eventually about methane which would double up to the surface and burst
EDL	00:09:31,391	00:09:32,415	| 99pi-0086-reversaloffortune-1 |	Also
EDL	00:09:32,415	00:09:33,695	| 99pi-0086-reversaloffortune-1 |	Sometimes a confiar
EDL	00:09:33,695	00:09:35,231	| 99pi-0086-reversaloffortune-1 |	And sometimes the sewage
EDL	00:09:35,231	00:09:38,815	| 99pi-0086-reversaloffortune-1 |	Got swept more than 2 miles out and found the water intakes
EDL	00:09:38,815	00:09:42,399	| 99pi-0086-reversaloffortune-1 |	Later they dig these even further out there's one called The Four Mile Creek
EDL	00:09:42,399	00:09:47,007	| 99pi-0086-reversaloffortune-1 |	And meanwhile the city kept growing by 1880 we're talking half a million people
EDL	00:09:47,007	00:09:48,287	| 99pi-0086-reversaloffortune-1 |	End producing more X
EDL	00:09:49,311	00:09:50,335	| 99pi-0086-reversaloffortune-1 |	The Stockyards group 2
EDL	00:09:50,847	00:09:51,359	| 99pi-0086-reversaloffortune-1 |	A lot
EDL	00:09:51,871	00:09:53,151	| 99pi-0086-reversaloffortune-1 |	When engineer would say
EDL	00:09:53,663	00:09:57,247	| 99pi-0086-reversaloffortune-1 |	Chicago produces more filth per capita than any other City
EDL	00:09:57,247	00:09:59,551	| 99pi-0086-reversaloffortune-1 |	And now typhoid was going to be a problem
EDL	00:09:59,551	00:10:03,647	| 99pi-0086-reversaloffortune-1 |	Turn Chicago started pushing for a new state law to help undertake the biggest
EDL	00:10:03,647	00:10:04,415	| 99pi-0086-reversaloffortune-1 |	Baddest
EDL	00:10:04,415	00:10:05,951	| 99pi-0086-reversaloffortune-1 |	Craziest idea ever
EDL	00:10:05,951	00:10:10,559	| 99pi-0086-reversaloffortune-1 |	They decided to dig a gigantic new Canal that would reverse the river entirely
EDL	00:10:10,559	00:10:13,375	| 99pi-0086-reversaloffortune-1 |	Reversing the river would bring in fresh water from the leg
EDL	00:10:13,375	00:10:17,983	| 99pi-0086-reversaloffortune-1 |	And keep Chicago's mug from polluting the drinking water pulled from that same leg
EDL	00:10:17,983	00:10:18,751	| 99pi-0086-reversaloffortune-1 |	And
EDL	00:10:18,751	00:10:21,567	| 99pi-0086-reversaloffortune-1 |	Flush all the sewage down to the Illinois River
EDL	00:10:21,567	00:10:23,615	| 99pi-0086-reversaloffortune-1 |	Which would then take it out to the Mississippi
EDL	00:10:24,127	00:10:30,015	| 99pi-0086-reversaloffortune-1 |	It took a few years to get the new law prude the town of Joliet so a river of crap coming its way and try to mix it
EDL	00:10:30,015	00:10:31,551	| 99pi-0086-reversaloffortune-1 |	And then it took a few more years
EDL	00:10:31,551	00:10:33,343	| 99pi-0086-reversaloffortune-1 |	To get plans laid out in contract issue
EDL	00:10:34,111	00:10:35,391	| 99pi-0086-reversaloffortune-1 |	Red shovel day
EDL	00:10:35,903	00:10:37,695	| 99pi-0086-reversaloffortune-1 |	September 3rd 1892
EDL	00:10:38,207	00:10:39,999	| 99pi-0086-reversaloffortune-1 |	More than a thousand people came out to watch
EDL	00:10:40,511	00:10:43,327	| 99pi-0086-reversaloffortune-1 |	An official took one cut with a nickel-plated shovel
EDL	00:10:43,327	00:10:45,887	| 99pi-0086-reversaloffortune-1 |	And then an engineer detonated to massive loads of dynamite
EDL	00:10:46,655	00:10:47,679	| 99pi-0086-reversaloffortune-1 |	Dynamite was there
