EDL	Record In	Record Out	Clipname	Subtitle
EDL	00:22:17,088	00:22:21,184	| 99pi-0086-reversaloffortune-1 |	Or put on 50 pounds all of a sudden to play like a dad
EDL	00:22:22,976	00:22:25,792	| 99pi-0086-reversaloffortune-1 |	I'm a Hollywood trainer and I specialize in that stuff
EDL	00:22:25,792	00:22:28,096	| 99pi-0086-reversaloffortune-1 |	Actually if I'm being honest
EDL	00:22:28,096	00:22:29,888	| 99pi-0086-reversaloffortune-1 |	I'm one of the main guy to know how to do that
EDL	00:22:31,424	00:22:37,824	| 99pi-0086-reversaloffortune-1 |	A few days ago Wesley Stern and actor that I was helping to get huge for an action movie called Immortal cop
EDL	00:22:37,824	00:22:41,152	| 99pi-0086-reversaloffortune-1 |	Was found dead in my private gym
EDL	00:22:41,152	00:22:44,480	| 99pi-0086-reversaloffortune-1 |	Crushed inside a high-tech weight machine
EDL	00:22:44,480	00:22:48,832	| 99pi-0086-reversaloffortune-1 |	Even worse the cops think that I had something to do with it
EDL	00:22:48,832	00:22:49,856	| 99pi-0086-reversaloffortune-1 |	Now
EDL	00:22:49,856	00:22:51,648	| 99pi-0086-reversaloffortune-1 |	I need to clear my name
EDL	00:22:52,160	00:22:58,048	| 99pi-0086-reversaloffortune-1 |	Somebody out there killed Wesley and I'm going to do whatever it takes to find them
EDL	00:23:00,864	00:23:06,496	| 99pi-0086-reversaloffortune-1 |	Final episode of the body genius drops on May 30th Bend all 5 Parts on the truth podcast
EDL	00:23:06,496	00:23:07,008	| 99pi-0086-reversaloffortune-1 |	Dot-com 
